GO.ID	Term	Annotated	Significant	Expected	pval_test	pval_adj	ontology
GO:0034341	response to interferon-gamma	28	1	0.49	0.39049	1	BP
GO:0032095	regulation of response to food	28	1	0.49	0.39049	1	BP
GO:0032098	regulation of appetite	28	1	0.49	0.39049	1	BP
GO:0055017	cardiac muscle tissue growth	28	1	0.49	0.39049	1	BP
GO:0071396	cellular response to lipid	181	4	3.17	0.39079	1	BP
GO:0030183	B cell differentiation	77	2	1.35	0.39145	1	BP
GO:0043542	endothelial cell migration	77	2	1.35	0.39145	1	BP
GO:0097191	extrinsic apoptotic signaling pathway	77	2	1.35	0.39145	1	BP
GO:0032088	negative regulation of NF-kappaB transcr...	77	2	1.35	0.39145	1	BP
GO:0051252	regulation of RNA metabolic process	1160	39	20.3	0.39216	1	BP
GO:0048839	inner ear development	129	3	2.26	0.39366	1	BP
GO:0044703	multi-organism reproductive process	453	9	7.93	0.39653	1	BP
GO:1903038	negative regulation of leukocyte cell-ce...	35	3	0.61	0.39679	1	BP
GO:0046631	alpha-beta T cell activation	35	3	0.61	0.39679	1	BP
GO:0007179	transforming growth factor beta receptor...	78	2	1.36	0.39765	1	BP
GO:0071706	tumor necrosis factor superfamily cytoki...	78	2	1.36	0.39765	1	BP
GO:0032640	tumor necrosis factor production	78	2	1.36	0.39765	1	BP
GO:0042472	inner ear morphogenesis	78	2	1.36	0.39765	1	BP
GO:1903313	positive regulation of mRNA metabolic pr...	78	2	1.36	0.39765	1	BP
GO:0048639	positive regulation of developmental gro...	130	3	2.27	0.3984	1	BP
GO:0048311	mitochondrion distribution	29	1	0.51	0.40119	1	BP
GO:0015908	fatty acid transport	29	1	0.51	0.40119	1	BP
GO:0005977	glycogen metabolic process	29	1	0.51	0.40119	1	BP
GO:0051653	spindle localization	29	1	0.51	0.40119	1	BP
GO:0071675	regulation of mononuclear cell migration	29	1	0.51	0.40119	1	BP
GO:0006073	cellular glucan metabolic process	29	1	0.51	0.40119	1	BP
GO:1901222	regulation of NIK/NF-kappaB signaling	29	1	0.51	0.40119	1	BP
GO:0001919	regulation of receptor recycling	29	1	0.51	0.40119	1	BP
GO:0007095	mitotic G2 DNA damage checkpoint signali...	29	1	0.51	0.40119	1	BP
GO:0060419	heart growth	29	1	0.51	0.40119	1	BP
GO:1901655	cellular response to ketone	29	1	0.51	0.40119	1	BP
GO:0006112	energy reserve metabolic process	29	1	0.51	0.40119	1	BP
GO:0016049	cell growth	184	4	3.22	0.40273	1	BP
GO:0018108	peptidyl-tyrosine phosphorylation	79	2	1.38	0.40382	1	BP
GO:0051954	positive regulation of amine transport	79	2	1.38	0.40382	1	BP
GO:0018212	peptidyl-tyrosine modification	79	2	1.38	0.40382	1	BP
GO:0002064	epithelial cell development	79	2	1.38	0.40382	1	BP
GO:0046578	regulation of Ras protein signal transdu...	79	2	1.38	0.40382	1	BP
GO:0051179	localization	2801	66	49.01	0.40501	1	BP
GO:0010033	response to organic substance	1165	34	20.38	0.40647	1	BP
GO:0031647	regulation of protein stability	185	4	3.24	0.4067	1	BP
GO:0051704	multi-organism process	458	9	8.01	0.40923	1	BP
GO:0016125	sterol metabolic process	80	2	1.4	0.40996	1	BP
GO:0016525	negative regulation of angiogenesis	30	1	0.52	0.41171	1	BP
GO:0006821	chloride transport	30	1	0.52	0.41171	1	BP
GO:0045123	cellular extravasation	30	1	0.52	0.41171	1	BP
GO:0044042	glucan metabolic process	30	1	0.52	0.41171	1	BP
GO:0032413	negative regulation of ion transmembrane...	30	1	0.52	0.41171	1	BP
GO:1901343	negative regulation of vasculature devel...	30	1	0.52	0.41171	1	BP
GO:0007229	integrin-mediated signaling pathway	30	1	0.52	0.41171	1	BP
GO:2000378	negative regulation of reactive oxygen s...	30	1	0.52	0.41171	1	BP
GO:0008340	determination of adult lifespan	30	1	0.52	0.41171	1	BP
GO:2000181	negative regulation of blood vessel morp...	30	1	0.52	0.41171	1	BP
GO:0006942	regulation of striated muscle contractio...	30	1	0.52	0.41171	1	BP
GO:0007528	neuromuscular junction development	30	1	0.52	0.41171	1	BP
GO:0035282	segmentation	30	1	0.52	0.41171	1	BP
GO:0072676	lymphocyte migration	30	1	0.52	0.41171	1	BP
GO:0042417	dopamine metabolic process	30	1	0.52	0.41171	1	BP
GO:0046697	decidualization	30	1	0.52	0.41171	1	BP
GO:0007163	establishment or maintenance of cell pol...	89	6	1.56	0.41239	1	BP
GO:0007189	adenylate cyclase-activating G protein-c...	133	3	2.33	0.41257	1	BP
GO:0008544	epidermis development	133	3	2.33	0.41257	1	BP
GO:1902533	positive regulation of intracellular sig...	350	7	6.12	0.41408	1	BP
GO:0048638	regulation of developmental growth	187	4	3.27	0.41463	1	BP
GO:0051347	positive regulation of transferase activ...	187	4	3.27	0.41463	1	BP
GO:0007162	negative regulation of cell adhesion	88	4	1.54	0.41509	1	BP
GO:0009142	nucleoside triphosphate biosynthetic pro...	81	2	1.42	0.41608	1	BP
GO:0009266	response to temperature stimulus	81	2	1.42	0.41608	1	BP
GO:1902652	secondary alcohol metabolic process	81	2	1.42	0.41608	1	BP
GO:0043409	negative regulation of MAPK cascade	81	2	1.42	0.41608	1	BP
GO:0032412	regulation of ion transmembrane transpor...	81	2	1.42	0.41608	1	BP
GO:0051606	detection of stimulus	81	2	1.42	0.41608	1	BP
GO:0060041	retina development in camera-type eye	81	2	1.42	0.41608	1	BP
GO:0006909	phagocytosis	81	2	1.42	0.41608	1	BP
GO:0055067	monovalent inorganic cation homeostasis	81	2	1.42	0.41608	1	BP
GO:1903531	negative regulation of secretion by cell	134	3	2.34	0.41727	1	BP
GO:0072659	protein localization to plasma membrane	134	3	2.34	0.41727	1	BP
GO:0009152	purine ribonucleotide biosynthetic proce...	135	3	2.36	0.42196	1	BP
GO:0034260	negative regulation of GTPase activity	31	1	0.54	0.42204	1	BP
GO:0010332	response to gamma radiation	31	1	0.54	0.42204	1	BP
GO:0035019	somatic stem cell population maintenance	31	1	0.54	0.42204	1	BP
GO:0032410	negative regulation of transporter activ...	31	1	0.54	0.42204	1	BP
GO:0032104	regulation of response to extracellular ...	31	1	0.54	0.42204	1	BP
GO:0032107	regulation of response to nutrient level...	31	1	0.54	0.42204	1	BP
GO:0007602	phototransduction	31	1	0.54	0.42204	1	BP
GO:2000736	regulation of stem cell differentiation	31	1	0.54	0.42204	1	BP
GO:0044788	modulation by host of viral process	31	1	0.54	0.42204	1	BP
GO:0003007	heart morphogenesis	82	2	1.43	0.42215	1	BP
GO:0050729	positive regulation of inflammatory resp...	82	2	1.43	0.42215	1	BP
GO:0022898	regulation of transmembrane transporter ...	82	2	1.43	0.42215	1	BP
GO:0006913	nucleocytoplasmic transport	214	7	3.74	0.42332	1	BP
GO:0051169	nuclear transport	214	7	3.74	0.42332	1	BP
GO:0007167	enzyme linked receptor protein signaling...	325	11	5.69	0.42604	1	BP
GO:1990778	protein localization to cell periphery	190	4	3.32	0.42648	1	BP
GO:0022604	regulation of cell morphogenesis	136	3	2.38	0.42664	1	BP
GO:0030323	respiratory tube development	83	2	1.45	0.4282	1	BP
GO:0030324	lung development	83	2	1.45	0.4282	1	BP
GO:0030307	positive regulation of cell growth	83	2	1.45	0.4282	1	BP
GO:1903828	negative regulation of cellular protein ...	83	2	1.45	0.4282	1	BP
GO:0051099	positive regulation of binding	83	2	1.45	0.4282	1	BP
GO:1903052	positive regulation of proteolysis invol...	83	2	1.45	0.4282	1	BP
GO:1903364	positive regulation of cellular protein ...	83	2	1.45	0.4282	1	BP
GO:0099536	synaptic signaling	411	16	7.19	0.42868	1	BP
GO:0045893	positive regulation of transcription, DN...	564	20	9.87	0.42971	1	BP
GO:1903508	positive regulation of nucleic acid-temp...	564	20	9.87	0.42971	1	BP
GO:0051402	neuron apoptotic process	137	3	2.4	0.4313	1	BP
GO:1902532	negative regulation of intracellular sig...	246	5	4.3	0.43175	1	BP
GO:0009112	nucleobase metabolic process	32	1	0.56	0.43219	1	BP
GO:0006584	catecholamine metabolic process	32	1	0.56	0.43219	1	BP
GO:0043123	positive regulation of I-kappaB kinase/N...	32	1	0.56	0.43219	1	BP
GO:0033032	regulation of myeloid cell apoptotic pro...	32	1	0.56	0.43219	1	BP
GO:0009712	catechol-containing compound metabolic p...	32	1	0.56	0.43219	1	BP
GO:0051900	regulation of mitochondrial depolarizati...	32	1	0.56	0.43219	1	BP
GO:0042982	amyloid precursor protein metabolic proc...	32	1	0.56	0.43219	1	BP
GO:0032507	maintenance of protein location in cell	32	1	0.56	0.43219	1	BP
GO:0097164	ammonium ion metabolic process	32	1	0.56	0.43219	1	BP
GO:0006195	purine nucleotide catabolic process	32	1	0.56	0.43219	1	BP
GO:0032094	response to food	32	1	0.56	0.43219	1	BP
GO:0097202	activation of cysteine-type endopeptidas...	32	1	0.56	0.43219	1	BP
GO:0060291	long-term synaptic potentiation	32	1	0.56	0.43219	1	BP
GO:0042116	macrophage activation	32	1	0.56	0.43219	1	BP
GO:0010921	regulation of phosphatase activity	32	1	0.56	0.43219	1	BP
GO:0034446	substrate adhesion-dependent cell spread...	32	1	0.56	0.43219	1	BP
GO:0031345	negative regulation of cell projection o...	84	2	1.47	0.43421	1	BP
GO:0097190	apoptotic signaling pathway	302	6	5.28	0.43506	1	BP
GO:0072657	protein localization to membrane	302	6	5.28	0.43506	1	BP
GO:0007275	multicellular organism development	2138	58	37.41	0.43653	1	BP
GO:0006355	regulation of transcription, DNA-templat...	1017	34	17.79	0.43749	1	BP
GO:1903533	regulation of protein targeting	39	3	0.68	0.4375	1	BP
GO:0045739	positive regulation of DNA repair	85	2	1.49	0.44019	1	BP
GO:1903322	positive regulation of protein modificat...	85	2	1.49	0.44019	1	BP
GO:0008643	carbohydrate transport	85	2	1.49	0.44019	1	BP
GO:0051882	mitochondrial depolarization	33	1	0.58	0.44217	1	BP
GO:2000027	regulation of animal organ morphogenesis	33	1	0.58	0.44217	1	BP
GO:1901379	regulation of potassium ion transmembran...	33	1	0.58	0.44217	1	BP
GO:0046324	regulation of glucose import	33	1	0.58	0.44217	1	BP
GO:0098815	modulation of excitatory postsynaptic po...	33	1	0.58	0.44217	1	BP
GO:0048706	embryonic skeletal system development	33	1	0.58	0.44217	1	BP
GO:0045665	negative regulation of neuron differenti...	33	1	0.58	0.44217	1	BP
GO:0097352	autophagosome maturation	33	1	0.58	0.44217	1	BP
GO:0043535	regulation of blood vessel endothelial c...	33	1	0.58	0.44217	1	BP
GO:0070828	heterochromatin organization	33	1	0.58	0.44217	1	BP
GO:0042304	regulation of fatty acid biosynthetic pr...	33	1	0.58	0.44217	1	BP
GO:0034198	cellular response to amino acid starvati...	33	1	0.58	0.44217	1	BP
GO:0061077	chaperone-mediated protein folding	33	1	0.58	0.44217	1	BP
GO:1903506	regulation of nucleic acid-templated tra...	1019	34	17.83	0.44252	1	BP
GO:0001906	cell killing	53	5	0.93	0.44278	1	BP
GO:1901652	response to peptide	250	5	4.37	0.44559	1	BP
GO:0032409	regulation of transporter activity	86	2	1.5	0.44614	1	BP
GO:0060491	regulation of cell projection assembly	86	2	1.5	0.44614	1	BP
GO:0120032	regulation of plasma membrane bounded ce...	86	2	1.5	0.44614	1	BP
GO:0042471	ear morphogenesis	86	2	1.5	0.44614	1	BP
GO:0007498	mesoderm development	36	3	0.63	0.44707	1	BP
GO:0051250	negative regulation of lymphocyte activa...	40	3	0.7	0.44725	1	BP
GO:0009116	nucleoside metabolic process	34	1	0.59	0.45197	1	BP
GO:0001893	maternal placenta development	34	1	0.59	0.45197	1	BP
GO:0035023	regulation of Rho protein signal transdu...	34	1	0.59	0.45197	1	BP
GO:0007131	reciprocal meiotic recombination	34	1	0.59	0.45197	1	BP
GO:0042551	neuron maturation	34	1	0.59	0.45197	1	BP
GO:0033028	myeloid cell apoptotic process	34	1	0.59	0.45197	1	BP
GO:0060999	positive regulation of dendritic spine d...	34	1	0.59	0.45197	1	BP
GO:0010611	regulation of cardiac muscle hypertrophy	34	1	0.59	0.45197	1	BP
GO:0140527	reciprocal homologous recombination	34	1	0.59	0.45197	1	BP
GO:0021510	spinal cord development	34	1	0.59	0.45197	1	BP
GO:0046620	regulation of organ growth	34	1	0.59	0.45197	1	BP
GO:1901019	regulation of calcium ion transmembrane ...	34	1	0.59	0.45197	1	BP
GO:0014743	regulation of muscle hypertrophy	34	1	0.59	0.45197	1	BP
GO:0051173	positive regulation of nitrogen compound...	1198	32	20.96	0.45204	1	BP
GO:0019827	stem cell population maintenance	87	2	1.52	0.45205	1	BP
GO:0002253	activation of immune response	87	2	1.52	0.45205	1	BP
GO:0000956	nuclear-transcribed mRNA catabolic proce...	87	2	1.52	0.45205	1	BP
GO:0055082	cellular chemical homeostasis	419	8	7.33	0.45217	1	BP
GO:0043583	ear development	142	3	2.48	0.45441	1	BP
GO:0050900	leukocyte migration	142	3	2.48	0.45441	1	BP
GO:1902680	positive regulation of RNA biosynthetic ...	570	20	9.97	0.45535	1	BP
GO:0043065	positive regulation of apoptotic process	253	5	4.43	0.45592	1	BP
GO:1902531	regulation of intracellular signal trans...	645	12	11.28	0.45635	1	BP
GO:0051056	regulation of small GTPase mediated sign...	88	2	1.54	0.45793	1	BP
GO:0007517	muscle organ development	88	2	1.54	0.45793	1	BP
GO:0051146	striated muscle cell differentiation	88	2	1.54	0.45793	1	BP
GO:0051962	positive regulation of nervous system de...	143	3	2.5	0.45899	1	BP
GO:0090150	establishment of protein localization to...	143	3	2.5	0.45899	1	BP
GO:0051128	regulation of cellular component organiz...	1079	23	18.88	0.46054	1	BP
GO:0045446	endothelial cell differentiation	35	1	0.61	0.4616	1	BP
GO:0001825	blastocyst formation	35	1	0.61	0.4616	1	BP
GO:0048145	regulation of fibroblast proliferation	35	1	0.61	0.4616	1	BP
GO:0042632	cholesterol homeostasis	35	1	0.61	0.4616	1	BP
GO:0060048	cardiac muscle contraction	35	1	0.61	0.4616	1	BP
GO:0050852	T cell receptor signaling pathway	35	1	0.61	0.4616	1	BP
GO:0007622	rhythmic behavior	35	1	0.61	0.4616	1	BP
GO:0072523	purine-containing compound catabolic pro...	35	1	0.61	0.4616	1	BP
GO:0030512	negative regulation of transforming grow...	35	1	0.61	0.4616	1	BP
GO:0030516	regulation of axon extension	35	1	0.61	0.4616	1	BP
GO:0002065	columnar/cuboidal epithelial cell differ...	35	1	0.61	0.4616	1	BP
GO:0016242	negative regulation of macroautophagy	35	1	0.61	0.4616	1	BP
GO:0050994	regulation of lipid catabolic process	35	1	0.61	0.4616	1	BP
GO:0055064	chloride ion homeostasis	35	1	0.61	0.4616	1	BP
GO:0055083	monovalent inorganic anion homeostasis	35	1	0.61	0.4616	1	BP
GO:0070050	neuron cellular homeostasis	35	1	0.61	0.4616	1	BP
GO:0007169	transmembrane receptor protein tyrosine ...	199	4	3.48	0.46165	1	BP
GO:2001141	regulation of RNA biosynthetic process	1027	34	17.97	0.46258	1	BP
GO:0051048	negative regulation of secretion	144	3	2.52	0.46355	1	BP
GO:0098727	maintenance of cell number	89	2	1.56	0.46377	1	BP
GO:0010876	lipid localization	195	7	3.41	0.46569	1	BP
GO:0009893	positive regulation of metabolic process	1585	41	27.73	0.46665	1	BP
GO:0009260	ribonucleotide biosynthetic process	145	3	2.54	0.46809	1	BP
GO:0032434	regulation of proteasomal ubiquitin-depe...	90	2	1.57	0.46957	1	BP
GO:0021915	neural tube development	113	5	1.98	0.47065	1	BP
GO:0045445	myoblast differentiation	36	1	0.63	0.47107	1	BP
GO:1990928	response to amino acid starvation	36	1	0.63	0.47107	1	BP
GO:0010469	regulation of signaling receptor activit...	36	1	0.63	0.47107	1	BP
GO:0007405	neuroblast proliferation	36	1	0.63	0.47107	1	BP
GO:0009261	ribonucleotide catabolic process	36	1	0.63	0.47107	1	BP
GO:0032481	positive regulation of type I interferon...	36	1	0.63	0.47107	1	BP
GO:0010827	regulation of glucose transmembrane tran...	36	1	0.63	0.47107	1	BP
GO:0007618	mating	36	1	0.63	0.47107	1	BP
GO:0055092	sterol homeostasis	36	1	0.63	0.47107	1	BP
GO:1904063	negative regulation of cation transmembr...	36	1	0.63	0.47107	1	BP
GO:0003008	system process	784	20	13.72	0.47457	1	BP
GO:0010565	regulation of cellular ketone metabolic ...	91	2	1.59	0.47533	1	BP
GO:0051259	protein complex oligomerization	91	2	1.59	0.47533	1	BP
GO:0006816	calcium ion transport	147	3	2.57	0.47713	1	BP
GO:0046390	ribose phosphate biosynthetic process	147	3	2.57	0.47713	1	BP
GO:0006164	purine nucleotide biosynthetic process	147	3	2.57	0.47713	1	BP
GO:0060627	regulation of vesicle-mediated transport	277	9	4.85	0.4777	1	BP
GO:0021987	cerebral cortex development	37	1	0.65	0.48036	1	BP
GO:0048489	synaptic vesicle transport	37	1	0.65	0.48036	1	BP
GO:0038061	NIK/NF-kappaB signaling	37	1	0.65	0.48036	1	BP
GO:0043200	response to amino acid	37	1	0.65	0.48036	1	BP
GO:0019692	deoxyribose phosphate metabolic process	37	1	0.65	0.48036	1	BP
GO:0014055	acetylcholine secretion, neurotransmissi...	37	1	0.65	0.48036	1	BP
GO:0014056	regulation of acetylcholine secretion, n...	37	1	0.65	0.48036	1	BP
GO:0014057	positive regulation of acetylcholine sec...	37	1	0.65	0.48036	1	BP
GO:0002718	regulation of cytokine production involv...	37	1	0.65	0.48036	1	BP
GO:0050731	positive regulation of peptidyl-tyrosine...	37	1	0.65	0.48036	1	BP
GO:0019079	viral genome replication	37	1	0.65	0.48036	1	BP
GO:0003254	regulation of membrane depolarization	37	1	0.65	0.48036	1	BP
GO:0046546	development of primary male sexual chara...	37	1	0.65	0.48036	1	BP
GO:0008584	male gonad development	37	1	0.65	0.48036	1	BP
GO:0009394	2'-deoxyribonucleotide metabolic process	37	1	0.65	0.48036	1	BP
GO:0071168	protein localization to chromatin	37	1	0.65	0.48036	1	BP
GO:0050433	regulation of catecholamine secretion	92	2	1.61	0.48106	1	BP
GO:0046474	glycerophospholipid biosynthetic process	92	2	1.61	0.48106	1	BP
GO:0048518	positive regulation of biological proces...	2666	64	46.64	0.4819	1	BP
GO:0051716	cellular response to stimulus	2923	75	51.14	0.48479	1	BP
GO:0055080	cation homeostasis	375	7	6.56	0.48597	1	BP
GO:0043410	positive regulation of MAPK cascade	149	3	2.61	0.4861	1	BP
GO:0051952	regulation of amine transport	149	3	2.61	0.4861	1	BP
GO:0050432	catecholamine secretion	93	2	1.63	0.48675	1	BP
GO:0060541	respiratory system development	93	2	1.63	0.48675	1	BP
GO:0051651	maintenance of location in cell	93	2	1.63	0.48675	1	BP
GO:0046890	regulation of lipid biosynthetic process	93	2	1.63	0.48675	1	BP
GO:0055007	cardiac muscle cell differentiation	38	1	0.66	0.4895	1	BP
GO:0033685	negative regulation of luteinizing hormo...	38	1	0.66	0.4895	1	BP
GO:0032370	positive regulation of lipid transport	38	1	0.66	0.4895	1	BP
GO:0043266	regulation of potassium ion transport	38	1	0.66	0.4895	1	BP
GO:0070459	prolactin secretion	38	1	0.66	0.4895	1	BP
GO:0071542	dopaminergic neuron differentiation	38	1	0.66	0.4895	1	BP
GO:0032277	negative regulation of gonadotropin secr...	38	1	0.66	0.4895	1	BP
GO:0051932	synaptic transmission, GABAergic	38	1	0.66	0.4895	1	BP
GO:0043534	blood vessel endothelial cell migration	38	1	0.66	0.4895	1	BP
GO:0006356	regulation of transcription by RNA polym...	38	1	0.66	0.4895	1	BP
GO:0061526	acetylcholine secretion	38	1	0.66	0.4895	1	BP
GO:0070509	calcium ion import	38	1	0.66	0.4895	1	BP
GO:2000573	positive regulation of DNA biosynthetic ...	38	1	0.66	0.4895	1	BP
GO:0051279	regulation of release of sequestered cal...	38	1	0.66	0.4895	1	BP
GO:0019219	regulation of nucleobase-containing comp...	1340	41	23.44	0.49056	1	BP
GO:0030163	protein catabolic process	547	10	9.57	0.4906	1	BP
GO:0009892	negative regulation of metabolic process	1164	36	20.37	0.49086	1	BP
GO:0031334	positive regulation of protein-containin...	94	2	1.64	0.4924	1	BP
GO:0006811	ion transport	697	16	12.19	0.49271	1	BP
GO:0043010	camera-type eye development	158	5	2.76	0.49418	1	BP
GO:0033554	cellular response to stress	1017	22	17.79	0.49452	1	BP
GO:0071214	cellular response to abiotic stimulus	151	3	2.64	0.495	1	BP
GO:0015837	amine transport	151	3	2.64	0.495	1	BP
GO:0072522	purine-containing compound biosynthetic ...	151	3	2.64	0.495	1	BP
GO:0104004	cellular response to environmental stimu...	151	3	2.64	0.495	1	BP
GO:0031668	cellular response to extracellular stimu...	137	7	2.4	0.49573	1	BP
GO:0007276	gamete generation	322	6	5.63	0.49704	1	BP
GO:0032271	regulation of protein polymerization	95	2	1.66	0.49802	1	BP
GO:0031644	regulation of nervous system process	95	2	1.66	0.49802	1	BP
GO:0061951	establishment of protein localization to...	39	1	0.68	0.49848	1	BP
GO:0033684	regulation of luteinizing hormone secret...	39	1	0.68	0.49848	1	BP
GO:0001738	morphogenesis of a polarized epithelium	39	1	0.68	0.49848	1	BP
GO:0001892	embryonic placenta development	39	1	0.68	0.49848	1	BP
GO:0034766	negative regulation of ion transmembrane...	39	1	0.68	0.49848	1	BP
GO:0009262	deoxyribonucleotide metabolic process	39	1	0.68	0.49848	1	BP
GO:1901374	acetate ester transport	39	1	0.68	0.49848	1	BP
GO:0014066	regulation of phosphatidylinositol 3-kin...	39	1	0.68	0.49848	1	BP
GO:0032874	positive regulation of stress-activated ...	39	1	0.68	0.49848	1	BP
GO:0019080	viral gene expression	39	1	0.68	0.49848	1	BP
GO:0015870	acetylcholine transport	39	1	0.68	0.49848	1	BP
GO:2000785	regulation of autophagosome assembly	39	1	0.68	0.49848	1	BP
GO:0097479	synaptic vesicle localization	39	1	0.68	0.49848	1	BP
GO:0090398	cellular senescence	39	1	0.68	0.49848	1	BP
GO:0035825	homologous recombination	39	1	0.68	0.49848	1	BP
GO:0032024	positive regulation of insulin secretion	39	1	0.68	0.49848	1	BP
GO:0050921	positive regulation of chemotaxis	39	1	0.68	0.49848	1	BP
GO:0061001	regulation of dendritic spine morphogene...	39	1	0.68	0.49848	1	BP
GO:0022414	reproductive process	690	15	12.07	0.49956	1	BP
GO:0010639	negative regulation of organelle organiz...	209	4	3.66	0.49985	1	BP
GO:0000003	reproduction	691	15	12.09	0.50168	1	BP
GO:0043523	regulation of neuron apoptotic process	96	2	1.68	0.50359	1	BP
GO:0048589	developmental growth	325	6	5.69	0.50616	1	BP
GO:0019724	B cell mediated immunity	40	1	0.7	0.50729	1	BP
GO:0003014	renal system process	40	1	0.7	0.50729	1	BP
GO:0016064	immunoglobulin mediated immune response	40	1	0.7	0.50729	1	BP
GO:0070304	positive regulation of stress-activated ...	40	1	0.7	0.50729	1	BP
GO:0098742	cell-cell adhesion via plasma-membrane a...	40	1	0.7	0.50729	1	BP
GO:0032275	luteinizing hormone secretion	40	1	0.7	0.50729	1	BP
GO:0032276	regulation of gonadotropin secretion	40	1	0.7	0.50729	1	BP
GO:0031638	zymogen activation	40	1	0.7	0.50729	1	BP
GO:0045814	negative regulation of gene expression, ...	40	1	0.7	0.50729	1	BP
GO:0014013	regulation of gliogenesis	40	1	0.7	0.50729	1	BP
GO:0009583	detection of light stimulus	40	1	0.7	0.50729	1	BP
GO:0055123	digestive system development	40	1	0.7	0.50729	1	BP
GO:0060998	regulation of dendritic spine developmen...	40	1	0.7	0.50729	1	BP
GO:0048640	negative regulation of developmental gro...	40	1	0.7	0.50729	1	BP
GO:0061512	protein localization to cilium	40	1	0.7	0.50729	1	BP
GO:0044818	mitotic G2/M transition checkpoint	40	1	0.7	0.50729	1	BP
GO:0007281	germ cell development	154	3	2.69	0.5082	1	BP
GO:0045834	positive regulation of lipid metabolic p...	97	2	1.7	0.50912	1	BP
GO:2001022	positive regulation of response to DNA d...	97	2	1.7	0.50912	1	BP
GO:0050727	regulation of inflammatory response	155	3	2.71	0.51256	1	BP
GO:0019953	sexual reproduction	385	7	6.74	0.51412	1	BP
GO:2000116	regulation of cysteine-type endopeptidas...	98	2	1.71	0.51462	1	BP
GO:0051896	regulation of protein kinase B signaling	41	1	0.72	0.51596	1	BP
GO:0033692	cellular polysaccharide biosynthetic pro...	41	1	0.72	0.51596	1	BP
GO:0030968	endoplasmic reticulum unfolded protein r...	41	1	0.72	0.51596	1	BP
GO:0044088	regulation of vacuole organization	41	1	0.72	0.51596	1	BP
GO:0051646	mitochondrion localization	41	1	0.72	0.51596	1	BP
GO:0032274	gonadotropin secretion	41	1	0.72	0.51596	1	BP
GO:0032231	regulation of actin filament bundle asse...	41	1	0.72	0.51596	1	BP
GO:0007043	cell-cell junction assembly	41	1	0.72	0.51596	1	BP
GO:0051101	regulation of DNA binding	41	1	0.72	0.51596	1	BP
GO:0060135	maternal process involved in female preg...	41	1	0.72	0.51596	1	BP
GO:0008625	extrinsic apoptotic signaling pathway vi...	41	1	0.72	0.51596	1	BP
GO:0051784	negative regulation of nuclear division	41	1	0.72	0.51596	1	BP
GO:0090257	regulation of muscle system process	156	3	2.73	0.5169	1	BP
GO:0048813	dendrite morphogenesis	99	2	1.73	0.52007	1	BP
GO:0051168	nuclear export	99	2	1.73	0.52007	1	BP
GO:0140013	meiotic nuclear division	99	2	1.73	0.52007	1	BP
GO:0006606	protein import into nucleus	122	5	2.13	0.52012	1	BP
GO:0051054	positive regulation of DNA metabolic pro...	157	3	2.75	0.52122	1	BP
GO:0007283	spermatogenesis	215	4	3.76	0.52222	1	BP
GO:0002367	cytokine production involved in immune r...	42	1	0.73	0.52447	1	BP
GO:0006893	Golgi to plasma membrane transport	42	1	0.73	0.52447	1	BP
GO:0001881	receptor recycling	42	1	0.73	0.52447	1	BP
GO:0061387	regulation of extent of cell growth	42	1	0.73	0.52447	1	BP
GO:1902093	positive regulation of flagellated sperm...	42	1	0.73	0.52447	1	BP
GO:0006096	glycolytic process	42	1	0.73	0.52447	1	BP
GO:0032224	positive regulation of synaptic transmis...	42	1	0.73	0.52447	1	BP
GO:0003353	positive regulation of cilium movement	42	1	0.73	0.52447	1	BP
GO:0008306	associative learning	42	1	0.73	0.52447	1	BP
GO:0030216	keratinocyte differentiation	42	1	0.73	0.52447	1	BP
GO:2000155	positive regulation of cilium-dependent ...	42	1	0.73	0.52447	1	BP
GO:0006903	vesicle targeting	42	1	0.73	0.52447	1	BP
GO:0030838	positive regulation of actin filament po...	42	1	0.73	0.52447	1	BP
GO:0007004	telomere maintenance via telomerase	42	1	0.73	0.52447	1	BP
GO:0031497	chromatin assembly	42	1	0.73	0.52447	1	BP
GO:0001101	response to acid chemical	42	1	0.73	0.52447	1	BP
GO:0006278	RNA-dependent DNA biosynthetic process	42	1	0.73	0.52447	1	BP
GO:0032496	response to lipopolysaccharide	100	2	1.75	0.52548	1	BP
GO:0007568	aging	100	2	1.75	0.52548	1	BP
GO:0006457	protein folding	100	2	1.75	0.52548	1	BP
GO:0007030	Golgi organization	100	2	1.75	0.52548	1	BP
GO:0006954	inflammatory response	274	5	4.79	0.5265	1	BP
GO:0033036	macromolecule localization	1566	39	27.4	0.52881	1	BP
GO:0006952	defense response	520	11	9.1	0.52925	1	BP
GO:0050877	nervous system process	506	9	8.85	0.52968	1	BP
GO:0006518	peptide metabolic process	564	10	9.87	0.53054	1	BP
GO:0014897	striated muscle hypertrophy	43	1	0.75	0.53284	1	BP
GO:0048144	fibroblast proliferation	43	1	0.75	0.53284	1	BP
GO:0010259	multicellular organism aging	43	1	0.75	0.53284	1	BP
GO:0070471	uterine smooth muscle contraction	43	1	0.75	0.53284	1	BP
GO:0070472	regulation of uterine smooth muscle cont...	43	1	0.75	0.53284	1	BP
GO:0070474	positive regulation of uterine smooth mu...	43	1	0.75	0.53284	1	BP
GO:0032222	regulation of synaptic transmission, cho...	43	1	0.75	0.53284	1	BP
GO:0003300	cardiac muscle hypertrophy	43	1	0.75	0.53284	1	BP
GO:0010811	positive regulation of cell-substrate ad...	43	1	0.75	0.53284	1	BP
GO:0010595	positive regulation of endothelial cell ...	43	1	0.75	0.53284	1	BP
