GO.ID	Term	Annotated	Significant	Expected	pval_test	pval_adj	ontology
GO:0051668	localization within membrane	1369	6	4.13	0.3861	1	BP
GO:0031667	response to nutrient levels	740	3	2.23	0.38691	1	BP
GO:0008544	epidermis development	546	5	1.65	0.38774	1	BP
GO:1901652	response to peptide	1023	13	3.09	0.38785	1	BP
GO:0046785	microtubule polymerization	162	1	0.49	0.38788	1	BP
GO:0006939	smooth muscle contraction	444	2	1.34	0.38821	1	BP
GO:0045934	negative regulation of nucleobase-contai...	1978	7	5.97	0.38835	1	BP
GO:0033993	response to lipid	1048	4	3.16	0.3897	1	BP
GO:0008625	extrinsic apoptotic signaling pathway vi...	163	1	0.49	0.38974	1	BP
GO:0051932	synaptic transmission, GABAergic	163	1	0.49	0.38974	1	BP
GO:1901653	cellular response to peptide	695	12	2.1	0.39089	1	BP
GO:0009605	response to external stimulus	3553	16	10.72	0.39113	1	BP
GO:2001021	negative regulation of response to DNA d...	165	1	0.5	0.39344	1	BP
GO:0014013	regulation of gliogenesis	165	1	0.5	0.39344	1	BP
GO:2000107	negative regulation of leukocyte apoptot...	165	1	0.5	0.39344	1	BP
GO:0043502	regulation of muscle adaptation	165	1	0.5	0.39344	1	BP
GO:0010038	response to metal ion	449	2	1.35	0.39355	1	BP
GO:0031497	chromatin assembly	166	1	0.5	0.39528	1	BP
GO:0051784	negative regulation of nuclear division	166	1	0.5	0.39528	1	BP
GO:2001234	negative regulation of apoptotic signali...	452	2	1.36	0.39674	1	BP
GO:0033135	regulation of peptidyl-serine phosphoryl...	167	1	0.5	0.39711	1	BP
GO:0015812	gamma-aminobutyric acid transport	167	1	0.5	0.39711	1	BP
GO:0006259	DNA metabolic process	2312	8	6.98	0.39748	1	BP
GO:0009888	tissue development	2798	12	8.44	0.39755	1	BP
GO:0048646	anatomical structure formation involved ...	1729	8	5.22	0.39838	1	BP
GO:0043547	positive regulation of GTPase activity	454	2	1.37	0.39886	1	BP
GO:1901317	regulation of flagellated sperm motility	168	1	0.51	0.39894	1	BP
GO:0044088	regulation of vacuole organization	168	1	0.51	0.39894	1	BP
GO:0050921	positive regulation of chemotaxis	168	1	0.51	0.39894	1	BP
GO:0001956	positive regulation of neurotransmitter ...	168	1	0.51	0.39894	1	BP
GO:1903539	protein localization to postsynaptic mem...	168	1	0.51	0.39894	1	BP
GO:0090329	regulation of DNA-dependent DNA replicat...	169	1	0.51	0.40076	1	BP
GO:0002821	positive regulation of adaptive immune r...	169	1	0.51	0.40076	1	BP
GO:0035106	operant conditioning	170	1	0.51	0.40258	1	BP
GO:0030330	DNA damage response, signal transduction...	170	1	0.51	0.40258	1	BP
GO:0043408	regulation of MAPK cascade	944	8	2.85	0.40296	1	BP
GO:0008610	lipid biosynthetic process	1692	6	5.11	0.40301	1	BP
GO:0035239	tube morphogenesis	1379	5	4.16	0.40329	1	BP
GO:0006633	fatty acid biosynthetic process	459	2	1.38	0.40416	1	BP
GO:0010259	multicellular organism aging	171	1	0.52	0.40439	1	BP
GO:0001881	receptor recycling	171	1	0.52	0.40439	1	BP
GO:0048729	tissue morphogenesis	1070	4	3.23	0.40478	1	BP
GO:1901991	negative regulation of mitotic cell cycl...	460	2	1.39	0.40521	1	BP
GO:0044093	positive regulation of molecular functio...	2647	9	7.99	0.40542	1	BP
GO:0062237	protein localization to postsynapse	172	1	0.52	0.4062	1	BP
GO:0051590	positive regulation of neurotransmitter ...	172	1	0.52	0.4062	1	BP
GO:0070192	chromosome organization involved in meio...	172	1	0.52	0.4062	1	BP
GO:0048583	regulation of response to stimulus	6228	32	18.79	0.40799	1	BP
GO:0008585	female gonad development	173	1	0.52	0.408	1	BP
GO:0033043	regulation of organelle organization	2407	10	7.26	0.408	1	BP
GO:0048514	blood vessel morphogenesis	769	3	2.32	0.41053	1	BP
GO:0032990	cell part morphogenesis	1111	6	3.35	0.41069	1	BP
GO:0048518	positive regulation of biological proces...	10780	42	32.53	0.4126	1	BP
GO:0006304	DNA modification	176	1	0.53	0.41338	1	BP
GO:0008277	regulation of G protein-coupled receptor...	176	1	0.53	0.41338	1	BP
GO:0071674	mononuclear cell migration	214	3	0.65	0.41396	1	BP
GO:0048869	cellular developmental process	6499	36	19.61	0.41439	1	BP
GO:0042113	B cell activation	524	7	1.58	0.41496	1	BP
GO:0008584	male gonad development	177	1	0.53	0.41516	1	BP
GO:0043122	regulation of I-kappaB kinase/NF-kappaB ...	177	1	0.53	0.41516	1	BP
GO:0045005	DNA-dependent DNA replication maintenanc...	177	1	0.53	0.41516	1	BP
GO:0046545	development of primary female sexual cha...	177	1	0.53	0.41516	1	BP
GO:0046546	development of primary male sexual chara...	177	1	0.53	0.41516	1	BP
GO:0032268	regulation of cellular protein metabolic...	3992	21	12.05	0.41538	1	BP
GO:0097746	blood vessel diameter maintenance	470	2	1.42	0.41573	1	BP
GO:0035150	regulation of tube size	470	2	1.42	0.41573	1	BP
GO:0035296	regulation of tube diameter	470	2	1.42	0.41573	1	BP
GO:1903522	regulation of blood circulation	471	2	1.42	0.41677	1	BP
GO:0007062	sister chromatid cohesion	178	1	0.54	0.41693	1	BP
GO:0110020	regulation of actomyosin structure organ...	178	1	0.54	0.41693	1	BP
GO:0001659	temperature homeostasis	520	8	1.57	0.41791	1	BP
GO:1901575	organic substance catabolic process	4989	17	15.05	0.41863	1	BP
GO:0051955	regulation of amino acid transport	179	1	0.54	0.4187	1	BP
GO:0006303	double-strand break repair via nonhomolo...	180	1	0.54	0.42046	1	BP
GO:0030518	intracellular steroid hormone receptor s...	181	1	0.55	0.42222	1	BP
GO:0060123	regulation of growth hormone secretion	181	1	0.55	0.42222	1	BP
GO:0006066	alcohol metabolic process	856	6	2.58	0.42352	1	BP
GO:0051881	regulation of mitochondrial membrane pot...	224	3	0.68	0.42438	1	BP
GO:0051707	response to other organism	1489	7	4.49	0.42441	1	BP
GO:1903829	positive regulation of cellular protein ...	479	2	1.45	0.42511	1	BP
GO:0043207	response to external biotic stimulus	1491	7	4.5	0.42559	1	BP
GO:0061515	myeloid cell development	183	1	0.55	0.42573	1	BP
GO:0001704	formation of primary germ layer	183	1	0.55	0.42573	1	BP
GO:0002833	positive regulation of response to bioti...	233	3	0.7	0.42618	1	BP
GO:0032446	protein modification by small protein co...	1418	5	4.28	0.42674	1	BP
GO:0051276	chromosome organization	2055	7	6.2	0.42698	1	BP
GO:0001932	regulation of protein phosphorylation	1637	10	4.94	0.42708	1	BP
GO:0051896	regulation of protein kinase B signaling	184	1	0.56	0.42747	1	BP
GO:1903076	regulation of protein localization to pl...	185	1	0.56	0.42921	1	BP
GO:0030252	growth hormone secretion	185	1	0.56	0.42921	1	BP
GO:0007605	sensory perception of sound	186	1	0.56	0.43094	1	BP
GO:1901796	regulation of signal transduction by p53...	186	1	0.56	0.43094	1	BP
GO:2001236	regulation of extrinsic apoptotic signal...	186	1	0.56	0.43094	1	BP
GO:1904062	regulation of cation transmembrane trans...	486	2	1.47	0.43236	1	BP
GO:0051899	membrane depolarization	187	1	0.56	0.43267	1	BP
GO:0030335	positive regulation of cell migration	849	5	2.56	0.43419	1	BP
GO:0034728	nucleosome organization	188	1	0.57	0.43439	1	BP
GO:0006333	chromatin assembly or disassembly	188	1	0.57	0.43439	1	BP
GO:0010927	cellular component assembly involved in ...	188	1	0.57	0.43439	1	BP
GO:0043401	steroid hormone mediated signaling pathw...	189	1	0.57	0.43611	1	BP
GO:0006360	transcription by RNA polymerase I	189	1	0.57	0.43611	1	BP
GO:0006351	transcription, DNA-templated	4335	14	13.08	0.43623	1	BP
GO:0051310	metaphase plate congression	190	1	0.57	0.43782	1	BP
GO:0022600	digestive system process	190	1	0.57	0.43782	1	BP
GO:0009141	nucleoside triphosphate metabolic proces...	492	2	1.48	0.43853	1	BP
GO:0006606	protein import into nucleus	492	2	1.48	0.43853	1	BP
GO:0097659	nucleic acid-templated transcription	4342	14	13.1	0.43874	1	BP
GO:0051147	regulation of muscle cell differentiatio...	191	1	0.58	0.43952	1	BP
GO:0080090	regulation of primary metabolic process	8620	35	26.01	0.44024	1	BP
GO:0016055	Wnt signaling pathway	807	3	2.43	0.44106	1	BP
GO:0001510	RNA methylation	192	1	0.58	0.44123	1	BP
GO:0071326	cellular response to monosaccharide stim...	192	1	0.58	0.44123	1	BP
GO:0071331	cellular response to hexose stimulus	192	1	0.58	0.44123	1	BP
GO:0071333	cellular response to glucose stimulus	192	1	0.58	0.44123	1	BP
GO:0051234	establishment of localization	9129	39	27.55	0.44268	1	BP
GO:0034504	protein localization to nucleus	811	3	2.45	0.44424	1	BP
GO:0032870	cellular response to hormone stimulus	1064	13	3.21	0.44439	1	BP
GO:1901992	positive regulation of mitotic cell cycl...	194	1	0.59	0.44461	1	BP
GO:0031396	regulation of protein ubiquitination	498	2	1.5	0.44467	1	BP
GO:0198738	cell-cell signaling by wnt	812	3	2.45	0.44504	1	BP
GO:0030879	mammary gland development	195	1	0.59	0.4463	1	BP
GO:0060295	regulation of cilium movement involved i...	195	1	0.59	0.4463	1	BP
GO:0043500	muscle adaptation	195	1	0.59	0.4463	1	BP
GO:1902019	regulation of cilium-dependent cell moti...	195	1	0.59	0.4463	1	BP
GO:0090068	positive regulation of cell cycle proces...	501	2	1.51	0.44773	1	BP
GO:0001959	regulation of cytokine-mediated signalin...	196	1	0.59	0.44798	1	BP
GO:0072594	establishment of protein localization to...	1135	4	3.42	0.44889	1	BP
GO:0007586	digestion	197	1	0.59	0.44966	1	BP
GO:0006261	DNA-dependent DNA replication	503	2	1.52	0.44976	1	BP
GO:0003012	muscle system process	819	3	2.47	0.45058	1	BP
GO:0051170	import into nucleus	504	2	1.52	0.45077	1	BP
GO:0031401	positive regulation of protein modificat...	1459	5	4.4	0.45122	1	BP
GO:0003073	regulation of systemic arterial blood pr...	198	1	0.6	0.45133	1	BP
GO:1901657	glycosyl compound metabolic process	198	1	0.6	0.45133	1	BP
GO:0051258	protein polymerization	505	2	1.52	0.45178	1	BP
GO:0002705	positive regulation of leukocyte mediate...	249	3	0.75	0.45289	1	BP
GO:0007585	respiratory gaseous exchange by respirat...	199	1	0.6	0.453	1	BP
GO:0050790	regulation of catalytic activity	3378	23	10.19	0.45436	1	BP
GO:0009913	epidermal cell differentiation	295	4	0.89	0.45457	1	BP
GO:0018105	peptidyl-serine phosphorylation	509	2	1.54	0.45583	1	BP
GO:0032774	RNA biosynthetic process	4393	14	13.26	0.45702	1	BP
GO:0050896	response to stimulus	13551	53	40.89	0.45772	1	BP
GO:0009179	purine ribonucleoside diphosphate metabo...	202	1	0.61	0.45796	1	BP
GO:0048705	skeletal system morphogenesis	243	4	0.73	0.45878	1	BP
GO:0009607	response to biotic stimulus	1549	7	4.67	0.45949	1	BP
GO:0009890	negative regulation of biosynthetic proc...	2285	11	6.89	0.4596	1	BP
GO:0032414	positive regulation of ion transmembrane...	203	1	0.61	0.45961	1	BP
GO:0043170	macromolecule metabolic process	15889	57	47.94	0.46067	1	BP
GO:0005975	carbohydrate metabolic process	1475	5	4.45	0.4607	1	BP
GO:0009994	oocyte differentiation	204	1	0.62	0.46125	1	BP
GO:0051223	regulation of protein transport	1155	4	3.49	0.46228	1	BP
GO:0009987	cellular process	27884	89	84.14	0.46268	1	BP
GO:0007596	blood coagulation	205	1	0.62	0.46289	1	BP
GO:0014827	intestine smooth muscle contraction	205	1	0.62	0.46289	1	BP
GO:0014831	gastro-intestinal system smooth muscle c...	205	1	0.62	0.46289	1	BP
GO:2000106	regulation of leukocyte apoptotic proces...	205	1	0.62	0.46289	1	BP
GO:0070374	positive regulation of ERK1 and ERK2 cas...	206	1	0.62	0.46452	1	BP
GO:0046717	acid secretion	206	1	0.62	0.46452	1	BP
GO:0002706	regulation of lymphocyte mediated immuni...	257	3	0.78	0.46579	1	BP
GO:0046916	cellular transition metal ion homeostasi...	207	1	0.62	0.46615	1	BP
GO:0072006	nephron development	207	1	0.62	0.46615	1	BP
GO:0032368	regulation of lipid transport	223	3	0.67	0.467	1	BP
GO:0007010	cytoskeleton organization	2461	8	7.43	0.4671	1	BP
GO:0060079	excitatory postsynaptic potential	208	1	0.63	0.46777	1	BP
GO:0045621	positive regulation of lymphocyte differ...	208	1	0.63	0.46777	1	BP
GO:0006405	RNA export from nucleus	208	1	0.63	0.46777	1	BP
GO:0071322	cellular response to carbohydrate stimul...	208	1	0.63	0.46777	1	BP
GO:0060828	regulation of canonical Wnt signaling pa...	521	2	1.57	0.46785	1	BP
GO:0045596	negative regulation of cell differentiat...	852	4	2.57	0.46858	1	BP
GO:0006302	double-strand break repair	842	3	2.54	0.46866	1	BP
GO:0051604	protein maturation	842	3	2.54	0.46866	1	BP
GO:0006022	aminoglycan metabolic process	243	3	0.73	0.46879	1	BP
GO:0007613	memory	209	1	0.63	0.46938	1	BP
GO:0050817	coagulation	209	1	0.63	0.46938	1	BP
GO:0009056	catabolic process	5805	19	17.52	0.46981	1	BP
GO:0007599	hemostasis	210	1	0.63	0.471	1	BP
GO:0050768	negative regulation of neurogenesis	210	1	0.63	0.471	1	BP
GO:0019222	regulation of metabolic process	10352	46	31.24	0.47127	1	BP
GO:1901264	carbohydrate derivative transport	231	3	0.7	0.47179	1	BP
GO:0046660	female sex differentiation	211	1	0.64	0.4726	1	BP
GO:0048593	camera-type eye morphogenesis	212	1	0.64	0.47421	1	BP
GO:0090501	RNA phosphodiester bond hydrolysis	212	1	0.64	0.47421	1	BP
GO:0060759	regulation of response to cytokine stimu...	212	1	0.64	0.47421	1	BP
GO:1903827	regulation of cellular protein localizat...	1173	4	3.54	0.47424	1	BP
GO:0016310	phosphorylation	3094	14	9.34	0.47456	1	BP
GO:0007088	regulation of mitotic nuclear division	213	1	0.64	0.4758	1	BP
GO:2001257	regulation of cation channel activity	213	1	0.64	0.4758	1	BP
GO:0042180	cellular ketone metabolic process	575	4	1.73	0.47675	1	BP
GO:0001678	cellular glucose homeostasis	214	1	0.65	0.4774	1	BP
GO:0032715	negative regulation of interleukin-6 pro...	214	1	0.65	0.4774	1	BP
GO:0032411	positive regulation of transporter activ...	215	1	0.65	0.47898	1	BP
GO:0000422	autophagy of mitochondrion	215	1	0.65	0.47898	1	BP
GO:0061726	mitochondrion disassembly	215	1	0.65	0.47898	1	BP
GO:0051961	negative regulation of nervous system de...	215	1	0.65	0.47898	1	BP
GO:0000070	mitotic sister chromatid segregation	533	2	1.61	0.47972	1	BP
GO:0051130	positive regulation of cellular componen...	2161	7	6.52	0.47977	1	BP
GO:0051179	localization	11394	45	34.38	0.48048	1	BP
GO:0051128	regulation of cellular component organiz...	4387	19	13.24	0.48146	1	BP
GO:0060255	regulation of macromolecule metabolic pr...	9045	37	27.29	0.48183	1	BP
GO:1903578	regulation of ATP metabolic process	217	1	0.65	0.48215	1	BP
GO:0018209	peptidyl-serine modification	537	2	1.62	0.48364	1	BP
GO:0019226	transmission of nerve impulse	218	1	0.66	0.48372	1	BP
GO:0051303	establishment of chromosome localization	218	1	0.66	0.48372	1	BP
GO:0050000	chromosome localization	218	1	0.66	0.48372	1	BP
GO:0060078	regulation of postsynaptic membrane pote...	219	1	0.66	0.48529	1	BP
GO:0001508	action potential	219	1	0.66	0.48529	1	BP
GO:0032890	regulation of organic acid transport	219	1	0.66	0.48529	1	BP
GO:0006811	ion transport	2838	14	8.56	0.48612	1	BP
GO:0031175	neuron projection development	1805	19	5.45	0.48634	1	BP
GO:0008637	apoptotic mitochondrial changes	220	1	0.66	0.48685	1	BP
GO:0010634	positive regulation of epithelial cell m...	220	1	0.66	0.48685	1	BP
GO:0015698	inorganic anion transport	220	1	0.66	0.48685	1	BP
GO:0032989	cellular component morphogenesis	1227	6	3.7	0.48691	1	BP
GO:0071417	cellular response to organonitrogen comp...	1163	13	3.51	0.4881	1	BP
GO:0043491	protein kinase B signaling	221	1	0.67	0.48841	1	BP
GO:0099565	chemical synaptic transmission, postsyna...	222	1	0.67	0.48997	1	BP
GO:0045892	negative regulation of transcription, DN...	1526	5	4.6	0.49063	1	BP
GO:0007589	body fluid secretion	223	1	0.67	0.49152	1	BP
GO:0044264	cellular polysaccharide metabolic proces...	223	1	0.67	0.49152	1	BP
GO:0035113	embryonic appendage morphogenesis	223	1	0.67	0.49152	1	BP
GO:0030326	embryonic limb morphogenesis	223	1	0.67	0.49152	1	BP
GO:0051048	negative regulation of secretion	569	4	1.72	0.49263	1	BP
GO:0006612	protein targeting to membrane	224	1	0.68	0.49306	1	BP
GO:0051963	regulation of synapse assembly	224	1	0.68	0.49306	1	BP
GO:0060341	regulation of cellular localization	1861	6	5.62	0.49411	1	BP
GO:0031668	cellular response to extracellular stimu...	548	2	1.65	0.49434	1	BP
GO:0010522	regulation of calcium ion transport into...	225	1	0.68	0.4946	1	BP
GO:0035590	purinergic nucleotide receptor signaling...	225	1	0.68	0.4946	1	BP
GO:0006513	protein monoubiquitination	226	1	0.68	0.49614	1	BP
GO:0050772	positive regulation of axonogenesis	226	1	0.68	0.49614	1	BP
GO:1903507	negative regulation of nucleic acid-temp...	1537	5	4.64	0.49702	1	BP
GO:0044087	regulation of cellular component biogene...	1867	6	5.63	0.49728	1	BP
GO:0009892	negative regulation of metabolic process	4694	23	14.16	0.49737	1	BP
GO:1902750	negative regulation of cell cycle G2/M p...	227	1	0.68	0.49767	1	BP
GO:0090066	regulation of anatomical structure size	1210	4	3.65	0.49851	1	BP
GO:0001568	blood vessel development	881	3	2.66	0.4987	1	BP
GO:0071426	ribonucleoprotein complex export from nu...	228	1	0.69	0.4992	1	BP
GO:1902679	negative regulation of RNA biosynthetic ...	1543	5	4.66	0.50049	1	BP
GO:0003352	regulation of cilium movement	230	1	0.69	0.50224	1	BP
GO:0031109	microtubule polymerization or depolymeri...	230	1	0.69	0.50224	1	BP
GO:0044070	regulation of anion transport	230	1	0.69	0.50224	1	BP
GO:0050954	sensory perception of mechanical stimulu...	231	1	0.7	0.50375	1	BP
GO:0071805	potassium ion transmembrane transport	231	1	0.7	0.50375	1	BP
GO:0009185	ribonucleoside diphosphate metabolic pro...	232	1	0.7	0.50526	1	BP
GO:0071166	ribonucleoprotein complex localization	232	1	0.7	0.50526	1	BP
GO:0043524	negative regulation of neuron apoptotic ...	232	1	0.7	0.50526	1	BP
GO:0045930	negative regulation of mitotic cell cycl...	560	2	1.69	0.50584	1	BP
GO:0061912	selective autophagy	233	1	0.7	0.50676	1	BP
GO:2000026	regulation of multicellular organismal d...	2056	10	6.2	0.50794	1	BP
GO:0002822	regulation of adaptive immune response b...	234	1	0.71	0.50826	1	BP
GO:1905952	regulation of lipid localization	251	3	0.76	0.50966	1	BP
GO:0006749	glutathione metabolic process	236	1	0.71	0.51125	1	BP
GO:0030071	regulation of mitotic metaphase/anaphase...	236	1	0.71	0.51125	1	BP
GO:0051702	biological process involved in interacti...	236	1	0.71	0.51125	1	BP
GO:0034968	histone lysine methylation	236	1	0.71	0.51125	1	BP
GO:0007006	mitochondrial membrane organization	237	1	0.72	0.51274	1	BP
GO:0048592	eye morphogenesis	237	1	0.72	0.51274	1	BP
GO:0044770	cell cycle phase transition	1233	4	3.72	0.51337	1	BP
GO:0050678	regulation of epithelial cell proliferat...	568	2	1.71	0.51342	1	BP
GO:0035265	organ growth	238	1	0.72	0.51422	1	BP
GO:0098739	import across plasma membrane	238	1	0.72	0.51422	1	BP
GO:0051493	regulation of cytoskeleton organization	903	3	2.72	0.51528	1	BP
GO:0010594	regulation of endothelial cell migration	239	1	0.72	0.51569	1	BP
GO:0005976	polysaccharide metabolic process	239	1	0.72	0.51569	1	BP
GO:0060284	regulation of cell development	905	3	2.73	0.51677	1	BP
GO:2000113	negative regulation of cellular macromol...	2061	10	6.22	0.5175	1	BP
GO:0070201	regulation of establishment of protein l...	1240	4	3.74	0.51785	1	BP
GO:0030010	establishment of cell polarity	241	1	0.73	0.51863	1	BP
GO:0071887	leukocyte apoptotic process	242	1	0.73	0.5201	1	BP
GO:2000112	regulation of cellular macromolecule bio...	5184	19	15.64	0.52013	1	BP
GO:0001667	ameboidal-type cell migration	576	2	1.74	0.52092	1	BP
GO:1901989	positive regulation of cell cycle phase ...	243	1	0.73	0.52156	1	BP
GO:0051966	regulation of synaptic transmission, glu...	243	1	0.73	0.52156	1	BP
GO:0010721	negative regulation of cell development	243	1	0.73	0.52156	1	BP
GO:1901214	regulation of neuron death	577	2	1.74	0.52185	1	BP
GO:0010959	regulation of metal ion transport	577	2	1.74	0.52185	1	BP
GO:0051952	regulation of amine transport	577	2	1.74	0.52185	1	BP
GO:0051235	maintenance of location	579	2	1.75	0.52371	1	BP
GO:0008152	metabolic process	21023	72	63.43	0.52485	1	BP
GO:0015695	organic cation transport	247	1	0.75	0.52735	1	BP
GO:2001243	negative regulation of intrinsic apoptot...	248	1	0.75	0.52879	1	BP
GO:0006935	chemotaxis	585	2	1.77	0.52927	1	BP
GO:0010468	regulation of gene expression	6538	22	19.73	0.5301	1	BP
GO:0015837	amine transport	586	2	1.77	0.53019	1	BP
GO:0007420	brain development	1310	6	3.95	0.53139	1	BP
GO:0032956	regulation of actin cytoskeleton organiz...	588	2	1.77	0.53203	1	BP
GO:0051346	negative regulation of hydrolase activit...	440	6	1.33	0.53213	1	BP
GO:0007091	metaphase/anaphase transition of mitotic...	251	1	0.76	0.53308	1	BP
GO:0010965	regulation of mitotic sister chromatid s...	251	1	0.76	0.53308	1	BP
GO:0010558	negative regulation of macromolecule bio...	2093	10	6.32	0.53341	1	BP
GO:0010507	negative regulation of autophagy	253	1	0.76	0.53591	1	BP
GO:0014821	phasic smooth muscle contraction	253	1	0.76	0.53591	1	BP
GO:0000902	cell morphogenesis	1651	7	4.98	0.53711	1	BP
GO:0045931	positive regulation of mitotic cell cycl...	254	1	0.77	0.53733	1	BP
GO:0045055	regulated exocytosis	594	2	1.79	0.53752	1	BP
GO:0043085	positive regulation of catalytic activit...	1946	6	5.87	0.53838	1	BP
GO:0071902	positive regulation of protein serine/th...	255	1	0.77	0.53873	1	BP
GO:0018022	peptidyl-lysine methylation	255	1	0.77	0.53873	1	BP
GO:0002819	regulation of adaptive immune response	255	1	0.77	0.53873	1	BP
GO:0006767	water-soluble vitamin metabolic process	255	1	0.77	0.53873	1	BP
GO:0001944	vasculature development	935	3	2.82	0.53887	1	BP
GO:0030001	metal ion transport	1275	9	3.85	0.53956	1	BP
GO:0022904	respiratory electron transport chain	256	1	0.77	0.54014	1	BP
GO:0006323	DNA packaging	256	1	0.77	0.54014	1	BP
GO:2000377	regulation of reactive oxygen species me...	261	1	0.79	0.54709	1	BP
GO:0006626	protein targeting to mitochondrion	261	1	0.79	0.54709	1	BP
GO:0035107	appendage morphogenesis	261	1	0.79	0.54709	1	BP
GO:0035108	limb morphogenesis	261	1	0.79	0.54709	1	BP
GO:0071496	cellular response to external stimulus	605	2	1.83	0.54747	1	BP
GO:0051252	regulation of RNA metabolic process	4649	14	14.03	0.54762	1	BP
GO:0043410	positive regulation of MAPK cascade	606	2	1.83	0.54837	1	BP
GO:0006865	amino acid transport	348	4	1.05	0.54844	1	BP
GO:0051216	cartilage development	262	1	0.79	0.54847	1	BP
GO:0048754	branching morphogenesis of an epithelial...	262	1	0.79	0.54847	1	BP
GO:0006820	anion transport	930	8	2.81	0.54957	1	BP
GO:0045987	positive regulation of smooth muscle con...	263	1	0.79	0.54984	1	BP
GO:0051306	mitotic sister chromatid separation	263	1	0.79	0.54984	1	BP
GO:0060632	regulation of microtubule-based movement	264	1	0.8	0.55121	1	BP
GO:0072330	monocarboxylic acid biosynthetic process	610	2	1.84	0.55195	1	BP
GO:0035264	multicellular organism growth	565	6	1.7	0.55207	1	BP
GO:0031324	negative regulation of cellular metaboli...	3729	20	11.25	0.55216	1	BP
GO:0050795	regulation of behavior	265	1	0.8	0.55258	1	BP
GO:0034284	response to monosaccharide	266	1	0.8	0.55394	1	BP
GO:0009746	response to hexose	266	1	0.8	0.55394	1	BP
GO:0009749	response to glucose	266	1	0.8	0.55394	1	BP
GO:0044260	cellular macromolecule metabolic process	13060	45	39.41	0.55471	1	BP
GO:0015748	organophosphate ester transport	289	3	0.87	0.55568	1	BP
GO:0050920	regulation of chemotaxis	268	1	0.81	0.55665	1	BP
GO:0051928	positive regulation of calcium ion trans...	268	1	0.81	0.55665	1	BP
GO:0045184	establishment of protein localization	4005	12	12.08	0.55686	1	BP
GO:0034765	regulation of ion transmembrane transpor...	616	2	1.86	0.55727	1	BP
GO:0007281	germ cell development	616	2	1.86	0.55727	1	BP
GO:0018107	peptidyl-threonine phosphorylation	269	1	0.81	0.558	1	BP
GO:0090257	regulation of muscle system process	617	2	1.86	0.55816	1	BP
GO:0065007	biological regulation	18773	69	56.64	0.55917	1	BP
GO:0010556	regulation of macromolecule biosynthetic...	5305	19	16.01	0.5596	1	BP
GO:0030111	regulation of Wnt signaling pathway	619	2	1.87	0.55992	1	BP
GO:0007204	positive regulation of cytosolic calcium...	619	2	1.87	0.55992	1	BP
GO:0050730	regulation of peptidyl-tyrosine phosphor...	271	1	0.82	0.56069	1	BP
GO:0006469	negative regulation of protein kinase ac...	431	6	1.3	0.56196	1	BP
GO:0019220	regulation of phosphate metabolic proces...	2242	11	6.76	0.56281	1	BP
GO:0051174	regulation of phosphorus metabolic proce...	2242	11	6.76	0.56281	1	BP
GO:0016567	protein ubiquitination	1315	4	3.97	0.56465	1	BP
GO:0043244	regulation of protein-containing complex...	274	1	0.83	0.56469	1	BP
GO:0045165	cell fate commitment	274	1	0.83	0.56469	1	BP
GO:0055076	transition metal ion homeostasis	275	1	0.83	0.56601	1	BP
GO:0043549	regulation of kinase activity	1169	8	3.53	0.56659	1	BP
GO:0001525	angiogenesis	627	2	1.89	0.56693	1	BP
GO:0031326	regulation of cellular biosynthetic proc...	5678	20	17.13	0.56715	1	BP
GO:0030833	regulation of actin filament polymerizat...	276	1	0.83	0.56733	1	BP
GO:0043271	negative regulation of ion transport	276	1	0.83	0.56733	1	BP
GO:0045933	positive regulation of muscle contractio...	276	1	0.83	0.56733	1	BP
GO:0045088	regulation of innate immune response	328	3	0.99	0.56782	1	BP
GO:0010810	regulation of cell-substrate adhesion	278	1	0.84	0.56996	1	BP
GO:0050870	positive regulation of T cell activation	278	1	0.84	0.56996	1	BP
GO:0048667	cell morphogenesis involved in neuron di...	1009	5	3.04	0.57016	1	BP
GO:0017038	protein import	631	2	1.9	0.5704	1	BP
GO:0007040	lysosome organization	279	1	0.84	0.57127	1	BP
GO:0080171	lytic vacuole organization	279	1	0.84	0.57127	1	BP
GO:0030218	erythrocyte differentiation	279	1	0.84	0.57127	1	BP
GO:0051246	regulation of protein metabolic process	4430	21	13.37	0.57192	1	BP
GO:0021953	central nervous system neuron differenti...	280	1	0.84	0.57258	1	BP
GO:0070507	regulation of microtubule cytoskeleton o...	280	1	0.84	0.57258	1	BP
GO:0007249	I-kappaB kinase/NF-kappaB signaling	280	1	0.84	0.57258	1	BP
GO:0009952	anterior/posterior pattern specification	281	1	0.85	0.57388	1	BP
GO:0018210	peptidyl-threonine modification	281	1	0.85	0.57388	1	BP
GO:1904064	positive regulation of cation transmembr...	281	1	0.85	0.57388	1	BP
GO:0061138	morphogenesis of a branching epithelium	282	1	0.85	0.57518	1	BP
GO:0007565	female pregnancy	282	1	0.85	0.57518	1	BP
GO:0051028	mRNA transport	282	1	0.85	0.57518	1	BP
GO:0002444	myeloid leukocyte mediated immunity	282	1	0.85	0.57518	1	BP
GO:0010243	response to organonitrogen compound	2064	15	6.23	0.57555	1	BP
GO:0016477	cell migration	2096	8	6.32	0.57567	1	BP
GO:0032970	regulation of actin filament-based proce...	638	2	1.93	0.57643	1	BP
GO:0032886	regulation of microtubule-based process	638	2	1.93	0.57643	1	BP
