GO.ID	Term	Annotated	Significant	Expected	pval_test	pval_adj	ontology
GO:0051346	negative regulation of hydrolase activit...	107	4	1.87	0.11751	1	BP
GO:0016055	Wnt signaling pathway	191	6	3.34	0.11778	1	BP
GO:1903202	negative regulation of oxidative stress-...	34	2	0.59	0.11871	1	BP
GO:0048278	vesicle docking	34	2	0.59	0.11871	1	BP
GO:0090100	positive regulation of transmembrane rec...	34	2	0.59	0.11871	1	BP
GO:0072009	nephron epithelium development	34	2	0.59	0.11871	1	BP
GO:0032989	cellular component morphogenesis	303	13	5.3	0.11898	1	BP
GO:0006476	protein deacetylation	69	3	1.21	0.11974	1	BP
GO:0198738	cell-cell signaling by wnt	192	6	3.36	0.11993	1	BP
GO:0046822	regulation of nucleocytoplasmic transpor...	56	5	0.98	0.12052	1	BP
GO:0050865	regulation of cell activation	257	11	4.5	0.12154	1	BP
GO:0016485	protein processing	150	5	2.62	0.12232	1	BP
GO:0007254	JNK cascade	70	3	1.22	0.12359	1	BP
GO:0009743	response to carbohydrate	70	3	1.22	0.12359	1	BP
GO:0051092	positive regulation of NF-kappaB transcr...	70	3	1.22	0.12359	1	BP
GO:0043407	negative regulation of MAP kinase activi...	35	2	0.61	0.12452	1	BP
GO:0030316	osteoclast differentiation	35	2	0.61	0.12452	1	BP
GO:0006611	protein export from nucleus	35	2	0.61	0.12452	1	BP
GO:0014902	myotube differentiation	35	2	0.61	0.12452	1	BP
GO:0010951	negative regulation of endopeptidase act...	35	2	0.61	0.12452	1	BP
GO:1902883	negative regulation of response to oxida...	35	2	0.61	0.12452	1	BP
GO:0006470	protein dephosphorylation	113	6	1.98	0.12459	1	BP
GO:0051336	regulation of hydrolase activity	378	10	6.61	0.12519	1	BP
GO:0021537	telencephalon development	110	4	1.92	0.12649	1	BP
GO:0010035	response to inorganic substance	195	6	3.41	0.12651	1	BP
GO:0070663	regulation of leukocyte proliferation	79	5	1.38	0.12745	1	BP
GO:0043549	regulation of kinase activity	286	8	5	0.12789	1	BP
GO:0010556	regulation of macromolecule biosynthetic...	1326	42	23.2	0.12868	1	BP
GO:0030098	lymphocyte differentiation	161	7	2.82	0.12943	1	BP
GO:0010038	response to metal ion	111	4	1.94	0.12954	1	BP
GO:0001776	leukocyte homeostasis	36	2	0.63	0.1304	1	BP
GO:0007259	receptor signaling pathway via JAK-STAT	36	2	0.63	0.1304	1	BP
GO:0014910	regulation of smooth muscle cell migrati...	36	2	0.63	0.1304	1	BP
GO:0090316	positive regulation of intracellular pro...	63	6	1.1	0.13053	1	BP
GO:0006986	response to unfolded protein	72	3	1.26	0.13141	1	BP
GO:0046098	guanine metabolic process	8	1	0.14	0.13175	1	BP
GO:0046053	dAMP metabolic process	8	1	0.14	0.13175	1	BP
GO:0046054	dGMP metabolic process	8	1	0.14	0.13175	1	BP
GO:0043312	neutrophil degranulation	8	1	0.14	0.13175	1	BP
GO:0003091	renal water homeostasis	8	1	0.14	0.13175	1	BP
GO:0007191	adenylate cyclase-activating dopamine re...	8	1	0.14	0.13175	1	BP
GO:0001845	phagolysosome assembly	8	1	0.14	0.13175	1	BP
GO:0120178	steroid hormone biosynthetic process	8	1	0.14	0.13175	1	BP
GO:0043174	nucleoside salvage	8	1	0.14	0.13175	1	BP
GO:0042532	negative regulation of tyrosine phosphor...	8	1	0.14	0.13175	1	BP
GO:0007252	I-kappaB phosphorylation	8	1	0.14	0.13175	1	BP
GO:0060623	regulation of chromosome condensation	8	1	0.14	0.13175	1	BP
GO:0045793	positive regulation of cell size	8	1	0.14	0.13175	1	BP
GO:0048799	animal organ maturation	8	1	0.14	0.13175	1	BP
GO:0072170	metanephric tubule development	8	1	0.14	0.13175	1	BP
GO:0002230	positive regulation of defense response ...	8	1	0.14	0.13175	1	BP
GO:1903847	regulation of aorta morphogenesis	8	1	0.14	0.13175	1	BP
GO:1903849	positive regulation of aorta morphogenes...	8	1	0.14	0.13175	1	BP
GO:0045820	negative regulation of glycolytic proces...	8	1	0.14	0.13175	1	BP
GO:1905651	regulation of artery morphogenesis	8	1	0.14	0.13175	1	BP
GO:1905653	positive regulation of artery morphogene...	8	1	0.14	0.13175	1	BP
GO:0072210	metanephric nephron development	8	1	0.14	0.13175	1	BP
GO:0072207	metanephric epithelium development	8	1	0.14	0.13175	1	BP
GO:2000406	positive regulation of T cell migration	8	1	0.14	0.13175	1	BP
GO:0046122	purine deoxyribonucleoside metabolic pro...	8	1	0.14	0.13175	1	BP
GO:0046124	purine deoxyribonucleoside catabolic pro...	8	1	0.14	0.13175	1	BP
GO:0006968	cellular defense response	8	1	0.14	0.13175	1	BP
GO:0050858	negative regulation of antigen receptor-...	8	1	0.14	0.13175	1	BP
GO:0046130	purine ribonucleoside catabolic process	8	1	0.14	0.13175	1	BP
GO:0010801	negative regulation of peptidyl-threonin...	8	1	0.14	0.13175	1	BP
GO:0060914	heart formation	8	1	0.14	0.13175	1	BP
GO:0043558	regulation of translational initiation i...	8	1	0.14	0.13175	1	BP
GO:0045649	regulation of macrophage differentiation	8	1	0.14	0.13175	1	BP
GO:2000269	regulation of fibroblast apoptotic proce...	8	1	0.14	0.13175	1	BP
GO:0021853	cerebral cortex GABAergic interneuron mi...	8	1	0.14	0.13175	1	BP
GO:0033194	response to hydroperoxide	8	1	0.14	0.13175	1	BP
GO:2000209	regulation of anoikis	8	1	0.14	0.13175	1	BP
GO:0035272	exocrine system development	8	1	0.14	0.13175	1	BP
GO:0060354	negative regulation of cell adhesion mol...	8	1	0.14	0.13175	1	BP
GO:0033235	positive regulation of protein sumoylati...	8	1	0.14	0.13175	1	BP
GO:0090335	regulation of brown fat cell differentia...	8	1	0.14	0.13175	1	BP
GO:0035855	megakaryocyte development	8	1	0.14	0.13175	1	BP
GO:0006196	AMP catabolic process	8	1	0.14	0.13175	1	BP
GO:0006166	purine ribonucleoside salvage	8	1	0.14	0.13175	1	BP
GO:0097292	XMP metabolic process	8	1	0.14	0.13175	1	BP
GO:0097293	XMP biosynthetic process	8	1	0.14	0.13175	1	BP
GO:0097294	'de novo' XMP biosynthetic process	8	1	0.14	0.13175	1	BP
GO:0002002	regulation of angiotensin levels in bloo...	8	1	0.14	0.13175	1	BP
GO:0051291	protein heterooligomerization	8	1	0.14	0.13175	1	BP
GO:0050996	positive regulation of lipid catabolic p...	8	1	0.14	0.13175	1	BP
GO:1902894	negative regulation of pri-miRNA transcr...	8	1	0.14	0.13175	1	BP
GO:0019222	regulation of metabolic process	2554	70	44.68	0.13237	1	BP
GO:0009628	response to abiotic stimulus	480	12	8.4	0.13379	1	BP
GO:0062197	cellular response to chemical stress	155	5	2.71	0.13514	1	BP
GO:0048477	oogenesis	73	3	1.28	0.13539	1	BP
GO:0007565	female pregnancy	73	3	1.28	0.13539	1	BP
GO:0060485	mesenchyme development	73	3	1.28	0.13539	1	BP
GO:2001234	negative regulation of apoptotic signali...	113	4	1.98	0.13575	1	BP
GO:0097696	receptor signaling pathway via STAT	37	2	0.65	0.13634	1	BP
GO:0002824	positive regulation of adaptive immune r...	37	2	0.65	0.13634	1	BP
GO:0014909	smooth muscle cell migration	37	2	0.65	0.13634	1	BP
GO:0090317	negative regulation of intracellular pro...	37	2	0.65	0.13634	1	BP
GO:0016239	positive regulation of macroautophagy	37	2	0.65	0.13634	1	BP
GO:0051205	protein insertion into membrane	37	2	0.65	0.13634	1	BP
GO:0046649	lymphocyte activation	276	13	4.83	0.13773	1	BP
GO:0001525	angiogenesis	156	5	2.73	0.13777	1	BP
GO:0019216	regulation of lipid metabolic process	200	6	3.5	0.13784	1	BP
GO:0032103	positive regulation of response to exter...	200	6	3.5	0.13784	1	BP
GO:0061025	membrane fusion	82	7	1.43	0.13858	1	BP
GO:0080090	regulation of primary metabolic process	2133	61	37.32	0.13859	1	BP
GO:1903039	positive regulation of leukocyte cell-ce...	85	7	1.49	0.1387	1	BP
GO:1903522	regulation of blood circulation	114	4	1.99	0.13889	1	BP
GO:0002831	regulation of response to biotic stimulu...	114	4	1.99	0.13889	1	BP
GO:0001816	cytokine production	268	10	4.69	0.13933	1	BP
GO:0034614	cellular response to reactive oxygen spe...	74	3	1.29	0.13941	1	BP
GO:0060348	bone development	74	3	1.29	0.13941	1	BP
GO:0000045	autophagosome assembly	74	3	1.29	0.13941	1	BP
GO:0002696	positive regulation of leukocyte activat...	171	9	2.99	0.14135	1	BP
GO:0071695	anatomical structure maturation	115	4	2.01	0.14207	1	BP
GO:0021954	central nervous system neuron developmen...	38	2	0.66	0.14235	1	BP
GO:0009124	nucleoside monophosphate biosynthetic pr...	38	2	0.66	0.14235	1	BP
GO:0098659	inorganic cation import across plasma me...	38	2	0.66	0.14235	1	BP
GO:0045685	regulation of glial cell differentiation	38	2	0.66	0.14235	1	BP
GO:0019915	lipid storage	38	2	0.66	0.14235	1	BP
GO:0090103	cochlea morphogenesis	38	2	0.66	0.14235	1	BP
GO:0099587	inorganic ion import across plasma membr...	38	2	0.66	0.14235	1	BP
GO:0071868	cellular response to monoamine stimulus	45	6	0.79	0.14246	1	BP
GO:0071870	cellular response to catecholamine stimu...	45	6	0.79	0.14246	1	BP
GO:0140029	exocytic process	83	7	1.45	0.14251	1	BP
GO:0051246	regulation of protein metabolic process	1095	27	19.16	0.1429	1	BP
GO:0001843	neural tube closure	75	3	1.31	0.14347	1	BP
GO:0060606	tube closure	75	3	1.31	0.14347	1	BP
GO:0014020	primary neural tube formation	75	3	1.31	0.14347	1	BP
GO:0006468	protein phosphorylation	617	17	10.79	0.14393	1	BP
GO:0009894	regulation of catabolic process	521	15	9.12	0.14456	1	BP
GO:0044342	type B pancreatic cell proliferation	12	3	0.21	0.14496	1	BP
GO:0051240	positive regulation of multicellular org...	725	20	12.68	0.14507	1	BP
GO:0050867	positive regulation of cell activation	173	9	3.03	0.14659	1	BP
GO:0001779	natural killer cell differentiation	9	1	0.16	0.14695	1	BP
GO:0060841	venous blood vessel development	9	1	0.16	0.14695	1	BP
GO:0060831	smoothened signaling pathway involved in...	9	1	0.16	0.14695	1	BP
GO:0010463	mesenchymal cell proliferation	9	1	0.16	0.14695	1	BP
GO:0035089	establishment of apical/basal cell polar...	9	1	0.16	0.14695	1	BP
GO:1904936	interneuron migration	9	1	0.16	0.14695	1	BP
GO:0046959	habituation	9	1	0.16	0.14695	1	BP
GO:0005979	regulation of glycogen biosynthetic proc...	9	1	0.16	0.14695	1	BP
GO:0060561	apoptotic process involved in morphogene...	9	1	0.16	0.14695	1	BP
GO:2001239	regulation of extrinsic apoptotic signal...	9	1	0.16	0.14695	1	BP
GO:0035929	steroid hormone secretion	9	1	0.16	0.14695	1	BP
GO:0048266	behavioral response to pain	9	1	0.16	0.14695	1	BP
GO:0060603	mammary gland duct morphogenesis	9	1	0.16	0.14695	1	BP
GO:0043278	response to morphine	9	1	0.16	0.14695	1	BP
GO:0046321	positive regulation of fatty acid oxidat...	9	1	0.16	0.14695	1	BP
GO:0048730	epidermis morphogenesis	9	1	0.16	0.14695	1	BP
GO:0034695	response to prostaglandin E	9	1	0.16	0.14695	1	BP
GO:1902992	negative regulation of amyloid precursor...	9	1	0.16	0.14695	1	BP
GO:0032232	negative regulation of actin filament bu...	9	1	0.16	0.14695	1	BP
GO:1901142	insulin metabolic process	9	1	0.16	0.14695	1	BP
GO:0048845	venous blood vessel morphogenesis	9	1	0.16	0.14695	1	BP
GO:0032757	positive regulation of interleukin-8 pro...	9	1	0.16	0.14695	1	BP
GO:0010866	regulation of triglyceride biosynthetic ...	9	1	0.16	0.14695	1	BP
GO:2000404	regulation of T cell migration	9	1	0.16	0.14695	1	BP
GO:1901223	negative regulation of NIK/NF-kappaB sig...	9	1	0.16	0.14695	1	BP
GO:0033314	mitotic DNA replication checkpoint signa...	9	1	0.16	0.14695	1	BP
GO:0036035	osteoclast development	9	1	0.16	0.14695	1	BP
GO:0050849	negative regulation of calcium-mediated ...	9	1	0.16	0.14695	1	BP
GO:0035162	embryonic hemopoiesis	9	1	0.16	0.14695	1	BP
GO:0021892	cerebral cortex GABAergic interneuron di...	9	1	0.16	0.14695	1	BP
GO:0021894	cerebral cortex GABAergic interneuron de...	9	1	0.16	0.14695	1	BP
GO:0050691	regulation of defense response to virus ...	9	1	0.16	0.14695	1	BP
GO:0046782	regulation of viral transcription	9	1	0.16	0.14695	1	BP
GO:0060353	regulation of cell adhesion molecule pro...	9	1	0.16	0.14695	1	BP
GO:0072526	pyridine-containing compound catabolic p...	9	1	0.16	0.14695	1	BP
GO:0060338	regulation of type I interferon-mediated...	9	1	0.16	0.14695	1	BP
GO:0046827	positive regulation of protein export fr...	9	1	0.16	0.14695	1	BP
GO:1904590	negative regulation of protein import	9	1	0.16	0.14695	1	BP
GO:0042308	negative regulation of protein import in...	9	1	0.16	0.14695	1	BP
GO:1990573	potassium ion import across plasma membr...	9	1	0.16	0.14695	1	BP
GO:2000831	regulation of steroid hormone secretion	9	1	0.16	0.14695	1	BP
GO:1901660	calcium ion export	9	1	0.16	0.14695	1	BP
GO:0035809	regulation of urine volume	9	1	0.16	0.14695	1	BP
GO:0071300	cellular response to retinoic acid	9	1	0.16	0.14695	1	BP
GO:0090190	positive regulation of branching involve...	9	1	0.16	0.14695	1	BP
GO:0010962	regulation of glucan biosynthetic proces...	9	1	0.16	0.14695	1	BP
GO:0090189	regulation of branching involved in uret...	9	1	0.16	0.14695	1	BP
GO:0002920	regulation of humoral immune response	9	1	0.16	0.14695	1	BP
GO:0002902	regulation of B cell apoptotic process	9	1	0.16	0.14695	1	BP
GO:0048646	anatomical structure formation involved ...	419	15	7.33	0.14704	1	BP
GO:0099072	regulation of postsynaptic membrane neur...	76	3	1.33	0.14757	1	BP
GO:0098732	macromolecule deacylation	76	3	1.33	0.14757	1	BP
GO:0031623	receptor internalization	76	3	1.33	0.14757	1	BP
GO:0010976	positive regulation of neuron projection...	76	3	1.33	0.14757	1	BP
GO:0035601	protein deacylation	76	3	1.33	0.14757	1	BP
GO:0031063	regulation of histone deacetylation	39	2	0.68	0.14841	1	BP
GO:0021761	limbic system development	39	2	0.68	0.14841	1	BP
GO:0043502	regulation of muscle adaptation	39	2	0.68	0.14841	1	BP
GO:0045860	positive regulation of protein kinase ac...	117	4	2.05	0.1485	1	BP
GO:0140352	export from cell	527	22	9.22	0.14935	1	BP
GO:0040029	regulation of gene expression, epigeneti...	77	3	1.35	0.15171	1	BP
GO:0042221	response to chemical	1524	46	26.66	0.15202	1	BP
GO:0050767	regulation of neurogenesis	162	5	2.83	0.15406	1	BP
GO:0002821	positive regulation of adaptive immune r...	40	2	0.7	0.15452	1	BP
GO:1901216	positive regulation of neuron death	40	2	0.7	0.15452	1	BP
GO:0072073	kidney epithelium development	40	2	0.7	0.15452	1	BP
GO:0031124	mRNA 3'-end processing	40	2	0.7	0.15452	1	BP
GO:2000243	positive regulation of reproductive proc...	78	3	1.36	0.15588	1	BP
GO:0016241	regulation of macroautophagy	78	3	1.36	0.15588	1	BP
GO:0001934	positive regulation of protein phosphory...	231	9	4.04	0.15635	1	BP
GO:0070997	neuron death	208	6	3.64	0.15694	1	BP
GO:0071867	response to monoamine	46	6	0.8	0.15699	1	BP
GO:0071869	response to catecholamine	46	6	0.8	0.15699	1	BP
GO:0033673	negative regulation of kinase activity	120	4	2.1	0.15837	1	BP
GO:0009615	response to virus	120	4	2.1	0.15837	1	BP
GO:0050776	regulation of immune response	302	8	5.28	0.15879	1	BP
GO:0098662	inorganic cation transmembrane transport	302	8	5.28	0.15879	1	BP
GO:0046824	positive regulation of nucleocytoplasmic...	31	4	0.54	0.15895	1	BP
GO:0009888	tissue development	682	22	11.93	0.15947	1	BP
GO:0045581	negative regulation of T cell differenti...	16	3	0.28	0.15978	1	BP
GO:0045620	negative regulation of lymphocyte differ...	16	3	0.28	0.15978	1	BP
GO:0010212	response to ionizing radiation	79	3	1.38	0.16009	1	BP
GO:0050714	positive regulation of protein secretion	79	3	1.38	0.16009	1	BP
GO:0014812	muscle cell migration	41	2	0.72	0.16067	1	BP
GO:1903428	positive regulation of reactive oxygen s...	10	1	0.17	0.16189	1	BP
GO:0009172	purine deoxyribonucleoside monophosphate...	10	1	0.17	0.16189	1	BP
GO:2000048	negative regulation of cell-cell adhesio...	10	1	0.17	0.16189	1	BP
GO:0001886	endothelial cell morphogenesis	10	1	0.17	0.16189	1	BP
GO:0099601	regulation of neurotransmitter receptor ...	10	1	0.17	0.16189	1	BP
GO:0035020	regulation of Rac protein signal transdu...	10	1	0.17	0.16189	1	BP
GO:0046958	nonassociative learning	10	1	0.17	0.16189	1	BP
GO:0033081	regulation of T cell differentiation in ...	10	1	0.17	0.16189	1	BP
GO:0061339	establishment or maintenance of monopola...	10	1	0.17	0.16189	1	BP
GO:0002283	neutrophil activation involved in immune...	10	1	0.17	0.16189	1	BP
GO:0071577	zinc ion transmembrane transport	10	1	0.17	0.16189	1	BP
GO:0046339	diacylglycerol metabolic process	10	1	0.17	0.16189	1	BP
GO:0061162	establishment of monopolar cell polarity	10	1	0.17	0.16189	1	BP
GO:0034694	response to prostaglandin	10	1	0.17	0.16189	1	BP
GO:0000255	allantoin metabolic process	10	1	0.17	0.16189	1	BP
GO:0014072	response to isoquinoline alkaloid	10	1	0.17	0.16189	1	BP
GO:2000403	positive regulation of lymphocyte migrat...	10	1	0.17	0.16189	1	BP
GO:2000191	regulation of fatty acid transport	10	1	0.17	0.16189	1	BP
GO:0046121	deoxyribonucleoside catabolic process	10	1	0.17	0.16189	1	BP
GO:0050869	negative regulation of B cell activation	10	1	0.17	0.16189	1	BP
GO:0032816	positive regulation of natural killer ce...	10	1	0.17	0.16189	1	BP
GO:2001044	regulation of integrin-mediated signalin...	10	1	0.17	0.16189	1	BP
GO:0060352	cell adhesion molecule production	10	1	0.17	0.16189	1	BP
GO:0022403	cell cycle phase	10	1	0.17	0.16189	1	BP
GO:0060337	type I interferon signaling pathway	10	1	0.17	0.16189	1	BP
GO:0090382	phagosome maturation	10	1	0.17	0.16189	1	BP
GO:0030513	positive regulation of BMP signaling pat...	10	1	0.17	0.16189	1	BP
GO:0072678	T cell migration	10	1	0.17	0.16189	1	BP
GO:0048010	vascular endothelial growth factor recep...	10	1	0.17	0.16189	1	BP
GO:0042454	ribonucleoside catabolic process	10	1	0.17	0.16189	1	BP
GO:1990504	dense core granule exocytosis	10	1	0.17	0.16189	1	BP
GO:0071357	cellular response to type I interferon	10	1	0.17	0.16189	1	BP
GO:0006152	purine nucleoside catabolic process	10	1	0.17	0.16189	1	BP
GO:2000112	regulation of cellular macromolecule bio...	1297	41	22.69	0.16287	1	BP
GO:0070647	protein modification by small protein co...	426	13	7.45	0.16319	1	BP
GO:0042445	hormone metabolic process	122	4	2.13	0.16507	1	BP
GO:0017157	regulation of exocytosis	131	6	2.29	0.16596	1	BP
GO:0042073	intraciliary transport	42	2	0.73	0.16688	1	BP
GO:0008593	regulation of Notch signaling pathway	42	2	0.73	0.16688	1	BP
GO:0006979	response to oxidative stress	212	6	3.71	0.16691	1	BP
GO:0009891	positive regulation of biosynthetic proc...	800	26	14	0.16728	1	BP
GO:0051171	regulation of nitrogen compound metaboli...	1993	56	34.87	0.16761	1	BP
GO:0045732	positive regulation of protein catabolic...	123	4	2.15	0.16847	1	BP
GO:0051707	response to other organism	367	11	6.42	0.16861	1	BP
GO:0001841	neural tube formation	81	3	1.42	0.16861	1	BP
GO:1905037	autophagosome organization	81	3	1.42	0.16861	1	BP
GO:0045088	regulation of innate immune response	81	3	1.42	0.16861	1	BP
GO:0032101	regulation of response to external stimu...	355	9	6.21	0.16876	1	BP
GO:0006417	regulation of translation	213	6	3.73	0.16944	1	BP
GO:0043207	response to external biotic stimulus	368	11	6.44	0.17053	1	BP
GO:0050679	positive regulation of epithelial cell p...	86	5	1.5	0.17204	1	BP
GO:0033993	response to lipid	261	7	4.57	0.17255	1	BP
GO:0031400	negative regulation of protein modificat...	261	7	4.57	0.17255	1	BP
GO:0009161	ribonucleoside monophosphate metabolic p...	43	2	0.75	0.17312	1	BP
GO:0010466	negative regulation of peptidase activit...	43	2	0.75	0.17312	1	BP
GO:0032387	negative regulation of intracellular tra...	43	2	0.75	0.17312	1	BP
GO:1903201	regulation of oxidative stress-induced c...	43	2	0.75	0.17312	1	BP
GO:0006641	triglyceride metabolic process	43	2	0.75	0.17312	1	BP
GO:0046328	regulation of JNK cascade	43	2	0.75	0.17312	1	BP
GO:0045598	regulation of fat cell differentiation	43	2	0.75	0.17312	1	BP
GO:0015872	dopamine transport	43	2	0.75	0.17312	1	BP
GO:0042113	B cell activation	125	4	2.19	0.17532	1	BP
GO:1903131	mononuclear cell differentiation	178	7	3.11	0.17566	1	BP
GO:0001783	B cell apoptotic process	11	1	0.19	0.17658	1	BP
GO:0033687	osteoblast proliferation	11	1	0.19	0.17658	1	BP
GO:0009169	purine ribonucleoside monophosphate cata...	11	1	0.19	0.17658	1	BP
GO:0030901	midbrain development	11	1	0.19	0.17658	1	BP
GO:0032369	negative regulation of lipid transport	11	1	0.19	0.17658	1	BP
GO:0019755	one-carbon compound transport	11	1	0.19	0.17658	1	BP
GO:0043153	entrainment of circadian clock by photop...	11	1	0.19	0.17658	1	BP
GO:0006654	phosphatidic acid biosynthetic process	11	1	0.19	0.17658	1	BP
GO:0042509	regulation of tyrosine phosphorylation o...	11	1	0.19	0.17658	1	BP
GO:0045747	positive regulation of Notch signaling p...	11	1	0.19	0.17658	1	BP
GO:0097049	motor neuron apoptotic process	11	1	0.19	0.17658	1	BP
GO:0032264	IMP salvage	11	1	0.19	0.17658	1	BP
GO:0034508	centromere complex assembly	11	1	0.19	0.17658	1	BP
GO:1902991	regulation of amyloid precursor protein ...	11	1	0.19	0.17658	1	BP
GO:0046473	phosphatidic acid metabolic process	11	1	0.19	0.17658	1	BP
GO:0009649	entrainment of circadian clock	11	1	0.19	0.17658	1	BP
GO:0048665	neuron fate specification	11	1	0.19	0.17658	1	BP
GO:0031998	regulation of fatty acid beta-oxidation	11	1	0.19	0.17658	1	BP
GO:0045602	negative regulation of endothelial cell ...	11	1	0.19	0.17658	1	BP
GO:0030890	positive regulation of B cell proliferat...	11	1	0.19	0.17658	1	BP
GO:0016486	peptide hormone processing	11	1	0.19	0.17658	1	BP
GO:1902476	chloride transmembrane transport	11	1	0.19	0.17658	1	BP
GO:0043605	cellular amide catabolic process	11	1	0.19	0.17658	1	BP
GO:0051447	negative regulation of meiotic cell cycl...	11	1	0.19	0.17658	1	BP
GO:0033233	regulation of protein sumoylation	11	1	0.19	0.17658	1	BP
GO:0097154	GABAergic neuron differentiation	11	1	0.19	0.17658	1	BP
GO:0060443	mammary gland morphogenesis	11	1	0.19	0.17658	1	BP
GO:0002092	positive regulation of receptor internal...	11	1	0.19	0.17658	1	BP
GO:0090183	regulation of kidney development	11	1	0.19	0.17658	1	BP
GO:0099558	maintenance of synapse structure	11	1	0.19	0.17658	1	BP
GO:0051051	negative regulation of transport	263	7	4.6	0.17719	1	BP
GO:0009967	positive regulation of signal transducti...	609	14	10.65	0.17738	1	BP
GO:0002699	positive regulation of immune effector p...	126	4	2.2	0.17879	1	BP
GO:0000288	nuclear-transcribed mRNA catabolic proce...	44	2	0.77	0.1794	1	BP
GO:0030282	bone mineralization	44	2	0.77	0.1794	1	BP
GO:0048675	axon extension	44	2	0.77	0.1794	1	BP
GO:0061515	myeloid cell development	44	2	0.77	0.1794	1	BP
GO:0090311	regulation of protein deacetylation	44	2	0.77	0.1794	1	BP
GO:1901654	response to ketone	44	2	0.77	0.1794	1	BP
GO:0006796	phosphate-containing compound metabolic ...	1267	34	22.17	0.18014	1	BP
GO:0001838	embryonic epithelial tube formation	84	3	1.47	0.18164	1	BP
GO:0007224	smoothened signaling pathway	84	3	1.47	0.18164	1	BP
GO:0072175	epithelial tube formation	84	3	1.47	0.18164	1	BP
GO:0010632	regulation of epithelial cell migration	84	3	1.47	0.18164	1	BP
GO:0007389	pattern specification process	158	11	2.76	0.1825	1	BP
GO:0042391	regulation of membrane potential	172	5	3.01	0.18286	1	BP
GO:0048511	rhythmic process	141	7	2.47	0.18323	1	BP
GO:2001236	regulation of extrinsic apoptotic signal...	45	2	0.79	0.18572	1	BP
GO:0043279	response to alkaloid	45	2	0.79	0.18572	1	BP
GO:0008589	regulation of smoothened signaling pathw...	45	2	0.79	0.18572	1	BP
GO:0009617	response to bacterium	173	5	3.03	0.18584	1	BP
GO:0001889	liver development	85	3	1.49	0.18604	1	BP
GO:0035966	response to topologically incorrect prot...	85	3	1.49	0.18604	1	BP
GO:0007219	Notch signaling pathway	85	3	1.49	0.18604	1	BP
GO:0008219	cell death	963	23	16.85	0.18646	1	BP
GO:0070665	positive regulation of leukocyte prolife...	53	4	0.93	0.18798	1	BP
GO:0016236	macroautophagy	174	5	3.04	0.18885	1	BP
GO:0042063	gliogenesis	129	4	2.26	0.18932	1	BP
GO:0052547	regulation of peptidase activity	129	4	2.26	0.18932	1	BP
GO:0001503	ossification	135	10	2.36	0.18988	1	BP
GO:0045444	fat cell differentiation	86	3	1.5	0.19047	1	BP
GO:0060401	cytosolic calcium ion transport	86	3	1.5	0.19047	1	BP
GO:0016540	protein autoprocessing	12	1	0.21	0.191	1	BP
GO:0009170	purine deoxyribonucleoside monophosphate...	12	1	0.21	0.191	1	BP
GO:0009128	purine nucleoside monophosphate cataboli...	12	1	0.21	0.191	1	BP
GO:1900543	negative regulation of purine nucleotide...	12	1	0.21	0.191	1	BP
GO:0007260	tyrosine phosphorylation of STAT protein	12	1	0.21	0.191	1	BP
GO:0043276	anoikis	12	1	0.21	0.191	1	BP
GO:0032289	central nervous system myelin formation	12	1	0.21	0.191	1	BP
GO:0046426	negative regulation of receptor signalin...	12	1	0.21	0.191	1	BP
GO:0061117	negative regulation of heart growth	12	1	0.21	0.191	1	BP
GO:0044346	fibroblast apoptotic process	12	1	0.21	0.191	1	BP
GO:0060043	regulation of cardiac muscle cell prolif...	12	1	0.21	0.191	1	BP
GO:0010882	regulation of cardiac muscle contraction...	12	1	0.21	0.191	1	BP
GO:0046129	purine ribonucleoside biosynthetic proce...	12	1	0.21	0.191	1	BP
GO:2000114	regulation of establishment of cell pola...	12	1	0.21	0.191	1	BP
GO:0015766	disaccharide transport	12	1	0.21	0.191	1	BP
GO:0039694	viral RNA genome replication	12	1	0.21	0.191	1	BP
GO:0032885	regulation of polysaccharide biosyntheti...	12	1	0.21	0.191	1	BP
GO:0015770	sucrose transport	12	1	0.21	0.191	1	BP
GO:0015772	oligosaccharide transport	12	1	0.21	0.191	1	BP
GO:0032814	regulation of natural killer cell activa...	12	1	0.21	0.191	1	BP
GO:0021879	forebrain neuron differentiation	12	1	0.21	0.191	1	BP
GO:1902455	negative regulation of stem cell populat...	12	1	0.21	0.191	1	BP
GO:2000765	regulation of cytoplasmic translation	12	1	0.21	0.191	1	BP
GO:1904893	negative regulation of receptor signalin...	12	1	0.21	0.191	1	BP
GO:0050687	negative regulation of defense response ...	12	1	0.21	0.191	1	BP
GO:0070873	regulation of glycogen metabolic process	12	1	0.21	0.191	1	BP
GO:0044209	AMP salvage	12	1	0.21	0.191	1	BP
GO:0021542	dentate gyrus development	12	1	0.21	0.191	1	BP
GO:0032677	regulation of interleukin-8 production	12	1	0.21	0.191	1	BP
GO:0032637	interleukin-8 production	12	1	0.21	0.191	1	BP
GO:0042451	purine nucleoside biosynthetic process	12	1	0.21	0.191	1	BP
GO:0042455	ribonucleoside biosynthetic process	12	1	0.21	0.191	1	BP
GO:0035850	epithelial cell differentiation involved...	12	1	0.21	0.191	1	BP
GO:0034340	response to type I interferon	12	1	0.21	0.191	1	BP
GO:0090162	establishment of epithelial cell polarit...	12	1	0.21	0.191	1	BP
GO:1900273	positive regulation of long-term synapti...	12	1	0.21	0.191	1	BP
GO:1902742	apoptotic process involved in developmen...	12	1	0.21	0.191	1	BP
GO:0060213	positive regulation of nuclear-transcrib...	12	1	0.21	0.191	1	BP
GO:1901020	negative regulation of calcium ion trans...	12	1	0.21	0.191	1	BP
GO:0055022	negative regulation of cardiac muscle ti...	12	1	0.21	0.191	1	BP
