GO.ID	Term	Annotated	Significant	Expected	pval_test	pval_adj	ontology
GO:0003009	skeletal muscle contraction	37	3	1.12	1	1	BP
GO:1900542	regulation of purine nucleotide metaboli...	43	2	1.3	1	1	BP
GO:1900543	negative regulation of purine nucleotide...	14	2	0.42	1	1	BP
GO:1903233	regulation of calcium ion-dependent exoc...	3	2	0.09	1	1	BP
GO:0061366	behavioral response to chemical pain	4	2	0.12	1	1	BP
GO:0032429	regulation of phospholipase A2 activity	6	3	0.18	1	1	BP
GO:0051651	maintenance of location in cell	103	6	3.11	1	1	BP
GO:1901374	acetate ester transport	6	2	0.18	1	1	BP
GO:1903792	negative regulation of anion transport	15	2	0.45	1	1	BP
GO:0071873	response to norepinephrine	3	2	0.09	1	1	BP
GO:0099054	presynapse assembly	31	3	0.94	1	1	BP
GO:0007263	nitric oxide mediated signal transductio...	17	2	0.51	1	1	BP
GO:0051630	acetylcholine uptake	2	2	0.06	1	1	BP
GO:0048260	positive regulation of receptor-mediated...	32	2	0.97	1	1	BP
GO:0048266	behavioral response to pain	16	2	0.48	1	1	BP
GO:0007254	JNK cascade	102	2	3.08	1	1	BP
GO:1903789	regulation of amino acid transmembrane t...	8	2	0.24	1	1	BP
GO:0007271	synaptic transmission, cholinergic	16	3	0.48	1	1	BP
GO:0009743	response to carbohydrate	101	8	3.05	1	1	BP
GO:0007224	smoothened signaling pathway	53	2	1.6	1	1	BP
GO:1903729	regulation of plasma membrane organizati...	14	2	0.42	1	1	BP
GO:0007215	glutamate receptor signaling pathway	36	4	1.09	1	1	BP
GO:1904375	regulation of protein localization to ce...	90	15	2.72	1	1	BP
GO:1904377	positive regulation of protein localizat...	51	9	1.54	1	1	BP
GO:0098712	L-glutamate import across plasma membran...	11	2	0.33	1	1	BP
GO:0098742	cell-cell adhesion via plasma-membrane a...	97	12	2.93	1	1	BP
GO:1901483	regulation of transcription factor catab...	3	2	0.09	1	1	BP
GO:0097090	presynaptic membrane organization	5	3	0.15	1	1	BP
GO:0043279	response to alkaloid	36	4	1.09	1	1	BP
GO:1902074	response to salt	14	2	0.42	1	1	BP
GO:1902075	cellular response to salt	7	2	0.21	1	1	BP
GO:0043243	positive regulation of protein-containin...	26	3	0.78	1	1	BP
GO:0032103	positive regulation of response to exter...	232	2	7	1	1	BP
GO:0062014	negative regulation of small molecule me...	42	2	1.27	1	1	BP
GO:1902017	regulation of cilium assembly	14	2	0.42	1	1	BP
GO:1902018	negative regulation of cilium assembly	5	2	0.15	1	1	BP
GO:1903859	regulation of dendrite extension	17	4	0.51	1	1	BP
GO:1902047	polyamine transmembrane transport	4	2	0.12	1	1	BP
GO:1905515	non-motile cilium assembly	14	2	0.42	1	1	BP
GO:0031663	lipopolysaccharide-mediated signaling pa...	43	2	1.3	1	1	BP
GO:0031664	regulation of lipopolysaccharide-mediate...	17	2	0.51	1	1	BP
GO:1903825	organic acid transmembrane transport	77	2	2.32	1	1	BP
GO:0062009	secondary palate development	19	3	0.57	1	1	BP
GO:0002793	positive regulation of peptide secretion	65	8	1.96	1	1	BP
GO:0098870	action potential propagation	10	3	0.3	1	1	BP
GO:0140115	export across plasma membrane	32	9	0.97	1	1	BP
GO:0098810	neurotransmitter reuptake	15	2	0.45	1	1	BP
GO:0098814	spontaneous synaptic transmission	6	3	0.18	1	1	BP
GO:0031630	regulation of synaptic vesicle fusion to...	12	6	0.36	1	1	BP
GO:0031632	positive regulation of synaptic vesicle ...	10	6	0.3	1	1	BP
GO:0009593	detection of chemical stimulus	54	5	1.63	1	1	BP
GO:0045879	negative regulation of smoothened signal...	13	2	0.39	1	1	BP
GO:0018198	peptidyl-cysteine modification	21	2	0.63	1	1	BP
GO:0000280	nuclear division	158	3	4.77	1	1	BP
GO:0014074	response to purine-containing compound	77	3	2.32	1	1	BP
GO:0061110	dense core granule biogenesis	5	2	0.15	1	1	BP
GO:1905664	regulation of calcium ion import across ...	17	2	0.51	1	1	BP
GO:0045836	positive regulation of meiotic nuclear d...	10	3	0.3	1	1	BP
GO:0014046	dopamine secretion	20	7	0.6	1	1	BP
GO:0035306	positive regulation of dephosphorylation	28	3	0.85	1	1	BP
GO:1900073	regulation of neuromuscular synaptic tra...	2	2	0.06	1	1	BP
GO:0035307	positive regulation of protein dephospho...	21	3	0.63	1	1	BP
GO:0050775	positive regulation of dendrite morphoge...	21	3	0.63	1	1	BP
GO:2000479	regulation of cAMP-dependent protein kin...	8	2	0.24	1	1	BP
GO:0003333	amino acid transmembrane transport	57	2	1.72	1	1	BP
GO:0002703	regulation of leukocyte mediated immunit...	130	2	3.92	1	1	BP
GO:0002704	negative regulation of leukocyte mediate...	43	2	1.3	1	1	BP
GO:0002706	regulation of lymphocyte mediated immuni...	89	2	2.69	1	1	BP
GO:0002707	negative regulation of lymphocyte mediat...	33	2	1	1	1	BP
GO:0002709	regulation of T cell mediated immunity	18	2	0.54	1	1	BP
GO:0060047	heart contraction	142	19	4.29	1	1	BP
GO:0018119	peptidyl-cysteine S-nitrosylation	11	2	0.33	1	1	BP
GO:1903523	negative regulation of blood circulation	24	4	0.72	1	1	BP
GO:1903525	regulation of membrane tubulation	5	2	0.15	1	1	BP
GO:1903514	release of sequestered calcium ion into ...	19	5	0.57	1	1	BP
GO:1901293	nucleoside phosphate biosynthetic proces...	101	2	3.05	1	1	BP
GO:0140238	presynaptic endocytosis	61	13	1.84	1	1	BP
GO:0090068	positive regulation of cell cycle proces...	88	3	2.66	1	1	BP
GO:0010827	regulation of glucose transmembrane tran...	38	6	1.15	1	1	BP
GO:0070296	sarcoplasmic reticulum calcium ion trans...	19	5	0.57	1	1	BP
GO:0002820	negative regulation of adaptive immune r...	22	2	0.66	1	1	BP
GO:0002822	regulation of adaptive immune response b...	74	2	2.23	1	1	BP
GO:0002823	negative regulation of adaptive immune r...	20	2	0.6	1	1	BP
GO:2000169	regulation of peptidyl-cysteine S-nitros...	6	2	0.18	1	1	BP
GO:0002819	regulation of adaptive immune response	77	2	2.32	1	1	BP
GO:0051941	regulation of amino acid uptake involved...	3	2	0.09	1	1	BP
GO:0051943	positive regulation of amino acid uptake...	2	2	0.06	1	1	BP
GO:0050881	musculoskeletal movement	44	3	1.33	1	1	BP
GO:0051946	regulation of glutamate uptake involved ...	3	2	0.09	1	1	BP
GO:0002833	positive regulation of response to bioti...	104	2	3.14	1	1	BP
GO:0051933	amino acid neurotransmitter reuptake	4	2	0.12	1	1	BP
GO:0051935	glutamate reuptake	4	2	0.12	1	1	BP
GO:0051938	L-glutamate import	12	2	0.36	1	1	BP
GO:0050879	multicellular organismal movement	44	3	1.33	1	1	BP
GO:0007585	respiratory gaseous exchange by respirat...	31	3	0.94	1	1	BP
GO:0008150	biological_process	7356	222	222	1	1	BP
GO:0098661	inorganic anion transmembrane transport	58	9	1.75	1	1	BP
GO:0006942	regulation of striated muscle contractio...	72	14	2.17	1	1	BP
GO:0098656	anion transmembrane transport	131	13	3.95	1	1	BP
GO:1903649	regulation of cytoplasmic transport	14	2	0.42	1	1	BP
GO:0001963	synaptic transmission, dopaminergic	20	4	0.6	1	1	BP
GO:0048537	mucosa-associated lymphoid tissue develo...	9	3	0.27	1	1	BP
GO:0006907	pinocytosis	13	2	0.39	1	1	BP
GO:0050806	positive regulation of synaptic transmis...	104	17	3.14	1	1	BP
GO:0040020	regulation of meiotic nuclear division	17	3	0.51	1	1	BP
GO:0010522	regulation of calcium ion transport into...	66	8	1.99	1	1	BP
GO:0010517	regulation of phospholipase activity	34	5	1.03	1	1	BP
GO:0010518	positive regulation of phospholipase act...	31	5	0.94	1	1	BP
GO:0001941	postsynaptic membrane organization	16	3	0.48	1	1	BP
GO:0043576	regulation of respiratory gaseous exchan...	19	3	0.57	1	1	BP
GO:0097320	plasma membrane tubulation	13	2	0.39	1	1	BP
GO:1905039	carboxylic acid transmembrane transport	77	2	2.32	1	1	BP
GO:2000243	positive regulation of reproductive proc...	67	3	2.02	1	1	BP
GO:0007625	grooming behavior	13	4	0.39	1	1	BP
GO:1904776	regulation of protein localization to ce...	5	3	0.15	1	1	BP
GO:1902307	positive regulation of sodium ion transm...	16	2	0.48	1	1	BP
GO:1901890	positive regulation of cell junction ass...	65	8	1.96	1	1	BP
GO:0002697	regulation of immune effector process	197	2	5.95	1	1	BP
GO:0002698	negative regulation of immune effector p...	78	2	2.35	1	1	BP
GO:0007635	chemosensory behavior	16	2	0.48	1	1	BP
GO:0015870	acetylcholine transport	6	2	0.18	1	1	BP
GO:0051350	negative regulation of lyase activity	13	2	0.39	1	1	BP
GO:0010656	negative regulation of muscle cell apopt...	29	3	0.88	1	1	BP
GO:0015872	dopamine transport	28	7	0.85	1	1	BP
GO:0015813	L-glutamate transmembrane transport	17	2	0.51	1	1	BP
GO:1901881	positive regulation of protein depolymer...	15	3	0.45	1	1	BP
GO:0015846	polyamine transport	4	2	0.12	1	1	BP
GO:0051342	regulation of cyclic-nucleotide phosphod...	9	3	0.27	1	1	BP
GO:1902475	L-alpha-amino acid transmembrane transpo...	35	2	1.06	1	1	BP
GO:0022406	membrane docking	30	6	0.91	1	1	BP
GO:0051339	regulation of lyase activity	36	2	1.09	1	1	BP
GO:0017014	protein nitrosylation	12	2	0.36	1	1	BP
GO:0015807	L-amino acid transport	35	2	1.06	1	1	BP
GO:0099172	presynapse organization	36	4	1.09	1	1	BP
GO:1900371	regulation of purine nucleotide biosynth...	20	2	0.6	1	1	BP
GO:0150105	protein localization to cell-cell juncti...	14	2	0.42	1	1	BP
GO:1900372	negative regulation of purine nucleotide...	2	2	0.06	1	1	BP
GO:0099177	regulation of trans-synaptic signaling	335	47	10.11	1	1	BP
GO:0072522	purine-containing compound biosynthetic ...	87	2	2.63	1	1	BP
GO:0070884	regulation of calcineurin-NFAT signaling...	16	2	0.48	1	1	BP
GO:0019934	cGMP-mediated signaling	27	2	0.81	1	1	BP
GO:0097484	dendrite extension	21	4	0.63	1	1	BP
GO:0060314	regulation of ryanodine-sensitive calciu...	12	4	0.36	1	1	BP
GO:0030808	regulation of nucleotide biosynthetic pr...	20	2	0.6	1	1	BP
GO:0030809	negative regulation of nucleotide biosyn...	2	2	0.06	1	1	BP
GO:0060341	regulation of cellular localization	418	38	12.62	1	1	BP
GO:1903046	meiotic cell cycle process	67	3	2.02	1	1	BP
GO:0070839	metal ion export	26	9	0.78	1	1	BP
GO:2000705	regulation of dense core granule biogene...	2	2	0.06	1	1	BP
GO:0036369	transcription factor catabolic process	3	2	0.09	1	1	BP
GO:0061564	axon development	301	19	9.08	1	1	BP
GO:0021532	neural tube patterning	16	2	0.48	1	1	BP
GO:0047496	vesicle transport along microtubule	25	3	0.75	1	1	BP
GO:0072697	protein localization to cell cortex	10	3	0.3	1	1	BP
GO:0046887	positive regulation of hormone secretion	86	8	2.6	1	1	BP
GO:0051446	positive regulation of meiotic cell cycl...	15	3	0.45	1	1	BP
GO:0044782	cilium organization	93	2	2.81	1	1	BP
GO:1902170	cellular response to reactive nitrogen s...	12	3	0.36	1	1	BP
GO:1903960	negative regulation of anion transmembra...	7	2	0.21	1	1	BP
GO:1903961	positive regulation of anion transmembra...	4	2	0.12	1	1	BP
GO:1902116	negative regulation of organelle assembl...	15	2	0.45	1	1	BP
GO:1903959	regulation of anion transmembrane transp...	14	4	0.42	1	1	BP
GO:0015695	organic cation transport	26	5	0.78	1	1	BP
GO:0070528	protein kinase C signaling	17	3	0.51	1	1	BP
GO:0043090	amino acid import	35	2	1.06	1	1	BP
GO:0106056	regulation of calcineurin-mediated signa...	16	2	0.48	1	1	BP
GO:0106058	positive regulation of calcineurin-media...	5	2	0.15	1	1	BP
GO:0106070	regulation of adenylate cyclase-activati...	10	3	0.3	1	1	BP
GO:0031340	positive regulation of vesicle fusion	13	6	0.39	1	1	BP
GO:1900407	regulation of cellular response to oxida...	27	2	0.81	1	1	BP
GO:2000807	regulation of synaptic vesicle clusterin...	8	3	0.24	1	1	BP
GO:0036465	synaptic vesicle recycling	66	13	1.99	1	1	BP
GO:0098916	anterograde trans-synaptic signaling	458	72	13.82	1	1	BP
GO:0045980	negative regulation of nucleotide metabo...	14	2	0.42	1	1	BP
GO:0060191	regulation of lipase activity	42	5	1.27	1	1	BP
GO:0060193	positive regulation of lipase activity	37	5	1.12	1	1	BP
GO:0098930	axonal transport	28	3	0.85	1	1	BP
GO:0006164	purine nucleotide biosynthetic process	86	2	2.6	1	1	BP
GO:1902267	regulation of polyamine transmembrane tr...	3	2	0.09	1	1	BP
GO:1901620	regulation of smoothened signaling pathw...	4	2	0.12	1	1	BP
GO:0002036	regulation of L-glutamate import across ...	4	2	0.12	1	1	BP
GO:0002038	positive regulation of L-glutamate impor...	2	2	0.06	1	1	BP
GO:0090427	activation of meiosis	5	3	0.15	1	1	BP
GO:1901632	regulation of synaptic vesicle membrane ...	12	6	0.36	1	1	BP
GO:1901634	positive regulation of synaptic vesicle ...	10	6	0.3	1	1	BP
GO:0034349	glial cell apoptotic process	13	3	0.39	1	1	BP
GO:0006140	regulation of nucleotide metabolic proce...	43	2	1.3	1	1	BP
GO:0034331	cell junction maintenance	35	4	1.06	1	1	BP
GO:0044843	cell cycle G1/S phase transition	131	10	3.95	1	1	BP
GO:0008589	regulation of smoothened signaling pathw...	39	2	1.18	1	1	BP
GO:0010958	regulation of amino acid import across p...	8	2	0.24	1	1	BP
GO:0051259	protein complex oligomerization	109	12	3.29	1	1	BP
GO:0051281	positive regulation of release of seques...	15	4	0.45	1	1	BP
GO:0051282	regulation of sequestering of calcium io...	51	6	1.54	1	1	BP
GO:0051283	negative regulation of sequestering of c...	51	6	1.54	1	1	BP
GO:0043954	cellular component maintenance	46	4	1.39	1	1	BP
GO:0051279	regulation of release of sequestered cal...	40	6	1.21	1	1	BP
GO:0010922	positive regulation of phosphatase activ...	12	3	0.36	1	1	BP
GO:0034453	microtubule anchoring	8	2	0.24	1	1	BP
GO:0051235	maintenance of location	167	6	5.04	1	1	BP
GO:2000651	positive regulation of sodium ion transm...	14	2	0.42	1	1	BP
GO:0002934	desmosome organization	6	2	0.18	1	1	BP
GO:0060271	cilium assembly	83	2	2.5	1	1	BP
GO:0140056	organelle localization by membrane tethe...	28	6	0.85	1	1	BP
GO:0051208	sequestering of calcium ion	51	6	1.54	1	1	BP
GO:0051209	release of sequestered calcium ion into ...	51	6	1.54	1	1	BP
GO:0050921	positive regulation of chemotaxis	83	2	2.5	1	1	BP
GO:0050926	regulation of positive chemotaxis	17	2	0.51	1	1	BP
GO:0050927	positive regulation of positive chemotax...	17	2	0.51	1	1	BP
GO:0050918	positive chemotaxis	27	2	0.81	1	1	BP
GO:0140013	meiotic nuclear division	59	3	1.78	1	1	BP
GO:0031122	cytoplasmic microtubule organization	26	2	0.78	1	1	BP
GO:0089718	amino acid import across plasma membrane	32	2	0.97	1	1	BP
GO:0031111	negative regulation of microtubule polym...	33	5	1	1	1	BP
GO:0051783	regulation of nuclear division	49	3	1.48	1	1	BP
GO:0051785	positive regulation of nuclear division	19	3	0.57	1	1	BP
GO:0090281	negative regulation of calcium ion impor...	11	2	0.33	1	1	BP
GO:1901018	positive regulation of potassium ion tra...	9	4	0.27	1	1	BP
GO:1902855	regulation of non-motile cilium assembly	7	2	0.21	1	1	BP
GO:1902882	regulation of response to oxidative stre...	32	2	0.97	1	1	BP
GO:0090277	positive regulation of peptide hormone s...	62	8	1.87	1	1	BP
GO:1902883	negative regulation of response to oxida...	9	2	0.27	1	1	BP
GO:0090279	regulation of calcium ion import	33	2	1	1	1	BP
GO:1990089	response to nerve growth factor	27	5	0.81	1	1	BP
GO:0030004	cellular monovalent inorganic cation hom...	58	3	1.75	1	1	BP
GO:1903423	positive regulation of synaptic vesicle ...	11	3	0.33	1	1	BP
GO:0099507	ligand-gated ion channel activity involv...	25	12	0.73	1.1e-12	3.0866e-09	MF
GO:0005516	calmodulin binding	137	22	4.01	4.9e-11	6.8747e-08	MF
GO:0044325	transmembrane transporter binding	85	17	2.49	2.5e-10	2.31495e-07	MF
GO:1904315	transmitter-gated ion channel activity i...	55	14	1.61	3.3e-10	2.31495e-07	MF
GO:0048306	calcium-dependent protein binding	74	13	2.16	1.7e-07	9.5404e-05	MF
GO:0005251	delayed rectifier potassium channel acti...	25	8	0.73	3.3e-07	0.00015433	MF
GO:0004890	GABA-A receptor activity	19	7	0.56	6.2e-07	0.000248531428571429	MF
GO:0022851	GABA-gated chloride ion channel activity	13	6	0.38	8.5e-07	0.0002981375	MF
GO:0005237	inhibitory extracellular ligand-gated io...	15	6	0.44	2.3e-06	0.000717088888888889	MF
GO:0015631	tubulin binding	145	19	4.24	3.9e-06	0.00107563333333333	MF
GO:0030165	PDZ domain binding	83	12	2.43	4.5e-06	0.00107563333333333	MF
GO:0008503	benzodiazepine receptor activity	10	5	0.29	4.6e-06	0.00107563333333333	MF
GO:0010856	adenylate cyclase activator activity	6	4	0.18	1e-05	0.00215846153846154	MF
GO:0050998	nitric-oxide synthase binding	12	5	0.35	1.4e-05	0.002806	MF
GO:0001786	phosphatidylserine binding	29	7	0.85	1.5e-05	0.002806	MF
GO:0004683	calmodulin-dependent protein kinase acti...	20	6	0.59	1.6e-05	0.002806	MF
GO:0019901	protein kinase binding	432	31	12.64	2.3e-05	0.00318863636363636	MF
GO:0031800	type 3 metabotropic glutamate receptor b...	3	3	0.09	2.5e-05	0.00318863636363636	MF
GO:0031997	N-terminal myristoylation domain binding	3	3	0.09	2.5e-05	0.00318863636363636	MF
GO:0030348	syntaxin-3 binding	3	3	0.09	2.5e-05	0.00318863636363636	MF
GO:0035403	histone kinase activity (H3-T6 specific)	3	3	0.09	2.5e-05	0.00318863636363636	MF
GO:0031432	titin binding	3	3	0.09	2.5e-05	0.00318863636363636	MF
GO:0050809	diazepam binding	8	4	0.23	4.5e-05	0.00537816666666667	MF
GO:0005544	calcium-dependent phospholipid binding	34	7	0.99	4.6e-05	0.00537816666666667	MF
GO:0030955	potassium ion binding	15	5	0.44	4.8e-05	0.00538752	MF
GO:0005231	excitatory extracellular ligand-gated io...	48	8	1.4	6.5e-05	0.007015	MF
GO:0099508	voltage-gated ion channel activity invol...	16	5	0.47	6.9e-05	0.00717088888888889	MF
GO:0000149	SNARE binding	52	11	1.52	8.7e-05	0.00871864285714286	MF
GO:0031749	D2 dopamine receptor binding	4	3	0.12	9.7e-05	0.00907273333333333	MF
GO:0004971	AMPA glutamate receptor activity	4	3	0.12	9.7e-05	0.00907273333333333	MF
GO:0009931	calcium-dependent protein serine/threoni...	25	7	0.73	0.00012	0.010861935483871	MF
GO:0030506	ankyrin binding	18	5	0.53	0.00013	0.011399375	MF
GO:0030276	clathrin binding	40	7	1.17	0.00014	0.0119042424242424	MF
GO:0008331	high voltage-gated calcium channel activ...	11	4	0.32	2e-04	0.0165058823529412	MF
GO:0005509	calcium ion binding	334	24	9.77	0.00022	0.0176377142857143	MF
GO:0043548	phosphatidylinositol 3-kinase binding	31	6	0.91	0.00023	0.0179272222222222	MF
GO:0098973	structural constituent of postsynaptic a...	5	3	0.15	0.00024	0.0182010810810811	MF
GO:0050750	low-density lipoprotein particle recepto...	12	4	0.35	0.00029	0.0214142105263158	MF
GO:0008017	microtubule binding	113	11	3.31	0.00044	0.0316574358974359	MF
GO:0004972	NMDA glutamate receptor activity	6	3	0.18	0.00046	0.032269	MF
GO:0005546	phosphatidylinositol-4,5-bisphosphate bi...	49	7	1.43	5e-04	0.034219512195122	MF
GO:0017075	syntaxin-1 binding	14	4	0.41	0.00057	0.0380814285714286	MF
GO:0048487	beta-tubulin binding	15	4	0.44	0.00075	0.0489418604651163	MF
GO:0004862	cAMP-dependent protein kinase inhibitor ...	7	3	0.2	0.00079	0.0492608888888889	MF
GO:0005388	P-type calcium transporter activity	7	3	0.2	0.00079	0.0492608888888889	MF
GO:0086080	protein binding involved in heterotypic ...	2	2	0.06	0.00085	0.0496895833333333	MF
GO:0004691	cAMP-dependent protein kinase activity	2	2	0.06	0.00085	0.0496895833333333	MF
GO:0031695	alpha-2B adrenergic receptor binding	2	2	0.06	0.00085	0.0496895833333333	MF
GO:0098918	structural constituent of synapse	23	7	0.67	0.0015	0.0858979591836735	MF
GO:0035925	mRNA 3'-UTR AU-rich region binding	18	4	0.53	0.00158	0.0886696	MF
GO:0042165	neurotransmitter binding	9	3	0.26	0.00182	0.10013568627451	MF
GO:0015459	potassium channel regulator activity	46	6	1.35	0.00206	0.111160769230769	MF
GO:0004117	calmodulin-dependent cyclic-nucleotide p...	3	2	0.09	0.00251	0.122883448275862	MF
GO:0008073	ornithine decarboxylase inhibitor activi...	3	2	0.09	0.00251	0.122883448275862	MF
GO:0048101	calcium- and calmodulin-regulated 3',5'-...	3	2	0.09	0.00251	0.122883448275862	MF
GO:0004705	JUN kinase activity	3	2	0.09	0.00251	0.122883448275862	MF
GO:0061891	calcium ion sensor activity	3	2	0.09	0.00251	0.122883448275862	MF
GO:0030235	nitric-oxide synthase regulator activity	10	3	0.29	0.00254	0.122883448275862	MF
GO:0106222	long noncoding RNA binding	11	3	0.32	0.00342	0.15732	MF
GO:0099626	voltage-gated calcium channel activity i...	11	3	0.32	0.00342	0.15732	MF
GO:0008179	adenylate cyclase binding	11	3	0.32	0.00342	0.15732	MF
GO:0031681	G-protein beta-subunit binding	23	4	0.67	0.00407	0.184200322580645	MF
GO:0005244	voltage-gated ion channel activity	143	25	4.18	0.00464	0.202032	MF
GO:0005246	calcium channel regulator activity	38	5	1.11	0.00467	0.202032	MF
GO:0046982	protein heterodimerization activity	173	12	5.06	0.00468	0.202032	MF
GO:0022849	glutamate-gated calcium ion channel acti...	4	2	0.12	0.00492	0.203022352941176	MF
GO:0031696	alpha-2C adrenergic receptor binding	4	2	0.12	0.00492	0.203022352941176	MF
GO:0005391	P-type sodium:potassium-exchanging trans...	4	2	0.12	0.00492	0.203022352941176	MF
GO:0015081	sodium ion transmembrane transporter act...	97	10	2.84	0.0054	0.2196	MF
GO:0043274	phospholipase binding	13	3	0.38	0.00568	0.225665633802817	MF
GO:0019904	protein domain specific binding	444	31	12.99	0.00571	0.225665633802817	MF
GO:0005254	chloride channel activity	55	11	1.61	0.00646	0.251760555555556	MF
GO:0005515	protein binding	4074	169	119.18	0.00656	0.252155616438356	MF
GO:0016597	amino acid binding	27	4	0.79	0.00737	0.279462432432432	MF
GO:0031694	alpha-2A adrenergic receptor binding	5	2	0.15	0.00804	0.296845263157895	MF
GO:0033192	calmodulin-dependent protein phosphatase...	5	2	0.15	0.00804	0.296845263157895	MF
GO:0120283	protein serine/threonine kinase binding	15	3	0.44	0.00866	0.3037495	MF
GO:0050811	GABA receptor binding	15	3	0.44	0.00866	0.3037495	MF
GO:0004115	3',5'-cyclic-AMP phosphodiesterase activ...	15	3	0.44	0.00866	0.3037495	MF
GO:0004698	calcium-dependent protein kinase C activ...	15	3	0.44	0.00866	0.3037495	MF
GO:0019903	protein phosphatase binding	101	8	2.95	0.00925	0.320438271604938	MF
GO:0008022	protein C-terminus binding	123	9	3.6	0.00979	0.335009024390244	MF
GO:0005245	voltage-gated calcium channel activity	31	7	0.91	0.00997	0.336051904761905	MF
GO:0099186	structural constituent of postsynapse	21	6	0.61	0.01006	0.336051904761905	MF
GO:0072542	protein phosphatase activator activity	16	3	0.47	0.01043	0.344312705882353	MF
GO:0005272	sodium channel activity	30	4	0.88	0.01075	0.35075	MF
GO:0035254	glutamate receptor binding	50	8	1.46	0.01095	0.353168965517241	MF
GO:0003779	actin binding	267	15	7.81	0.01146	0.361425	MF
GO:0097016	L27 domain binding	6	2	0.18	0.01182	0.361425	MF
GO:0008239	dipeptidyl-peptidase activity	6	2	0.18	0.01182	0.361425	MF
GO:1990239	steroid hormone binding	6	2	0.18	0.01182	0.361425	MF
GO:0019905	syntaxin binding	31	7	0.91	0.01185	0.361425	MF
GO:0015079	potassium ion transmembrane transporter ...	118	17	3.45	0.01212	0.365685161290323	MF
GO:0005267	potassium channel activity	94	14	2.75	0.01297	0.38716829787234	MF
GO:0005248	voltage-gated sodium channel activity	18	3	0.53	0.01456	0.430056421052632	MF
GO:0031386	protein tag	7	2	0.2	0.01623	0.450904752475248	MF
GO:0036312	phosphatidylinositol 3-kinase regulatory...	7	2	0.2	0.01623	0.450904752475248	MF
GO:0005436	sodium:phosphate symporter activity	7	2	0.2	0.01623	0.450904752475248	MF
GO:0016594	glycine binding	7	2	0.2	0.01623	0.450904752475248	MF
GO:0016595	glutamate binding	7	2	0.2	0.01623	0.450904752475248	MF
GO:0031402	sodium ion binding	7	2	0.2	0.01623	0.450904752475248	MF
GO:0030552	cAMP binding	19	3	0.56	0.01693	0.465740980392157	MF
GO:0050839	cell adhesion molecule binding	164	12	4.8	0.01913	0.521153203883495	MF
GO:0017111	nucleoside-triphosphatase activity	285	15	8.34	0.01973	0.532330576923077	MF
GO:0042731	PH domain binding	8	2	0.23	0.02123	0.567346476190476	MF
GO:0042802	identical protein binding	1094	43	32	0.02377	0.622634393939394	MF
GO:0008092	cytoskeletal protein binding	523	43	15.3	0.0247	0.622634393939394	MF
GO:0005200	structural constituent of cytoskeleton	44	7	1.29	0.02522	0.622634393939394	MF
GO:0051018	protein kinase A binding	22	3	0.64	0.02523	0.622634393939394	MF
GO:0097718	disordered domain specific binding	22	3	0.64	0.02523	0.622634393939394	MF
GO:0042043	neurexin family protein binding	9	2	0.26	0.02678	0.622634393939394	MF
GO:0098919	structural constituent of postsynaptic d...	9	2	0.26	0.02678	0.622634393939394	MF
GO:0005484	SNAP receptor activity	9	2	0.26	0.02678	0.622634393939394	MF
GO:0004679	AMP-activated protein kinase activity	9	2	0.26	0.02678	0.622634393939394	MF
GO:0008574	plus-end-directed microtubule motor acti...	9	2	0.26	0.02678	0.622634393939394	MF
GO:0046873	metal ion transmembrane transporter acti...	275	37	8.04	0.02749	0.622634393939394	MF
GO:0030507	spectrin binding	23	3	0.67	0.02841	0.622634393939394	MF
GO:0005261	cation channel activity	228	30	6.67	0.02891	0.622634393939394	MF
GO:0017124	SH3 domain binding	80	6	2.34	0.02921	0.622634393939394	MF
GO:0043183	vascular endothelial growth factor recep...	1	1	0.03	0.02925	0.622634393939394	MF
GO:0015657	branched-chain amino acid:sodium symport...	1	1	0.03	0.02925	0.622634393939394	MF
GO:0086057	voltage-gated calcium channel activity i...	1	1	0.03	0.02925	0.622634393939394	MF
GO:0005295	neutral amino acid:sodium symporter acti...	1	1	0.03	0.02925	0.622634393939394	MF
GO:0042835	BRE binding	1	1	0.03	0.02925	0.622634393939394	MF
GO:0030346	protein phosphatase 2B binding	1	1	0.03	0.02925	0.622634393939394	MF
GO:1905056	P-type calcium transporter activity invo...	1	1	0.03	0.02925	0.622634393939394	MF
GO:0070644	vitamin D response element binding	1	1	0.03	0.02925	0.622634393939394	MF
GO:0051428	peptide hormone receptor binding	1	1	0.03	0.02925	0.622634393939394	MF
GO:0051429	corticotropin-releasing hormone receptor...	1	1	0.03	0.02925	0.622634393939394	MF
GO:0051430	corticotropin-releasing hormone receptor...	1	1	0.03	0.02925	0.622634393939394	MF
GO:0033130	acetylcholine receptor binding	1	1	0.03	0.02925	0.622634393939394	MF
GO:0043168	anion binding	1126	48	32.94	0.02929	0.622634393939394	MF
GO:0051015	actin filament binding	149	9	4.36	0.0304	0.641371428571428	MF
GO:0030551	cyclic nucleotide binding	24	3	0.7	0.03178	0.655696176470588	MF
GO:0019894	kinesin binding	24	3	0.7	0.03178	0.655696176470588	MF
GO:0019211	phosphatase activator activity	24	3	0.7	0.03178	0.655696176470588	MF
GO:0098879	structural constituent of postsynaptic s...	10	2	0.29	0.03284	0.672620729927007	MF
GO:0097367	carbohydrate derivative binding	1060	41	31.01	0.03428	0.697026666666667	MF
GO:0005216	ion channel activity	300	41	8.78	0.03509	0.706310285714286	MF
GO:0016462	pyrophosphatase activity	307	15	8.98	0.03524	0.706310285714286	MF
GO:0016817	hydrolase activity, acting on acid anhyd...	310	15	9.07	0.0379	0.748925352112676	MF
GO:0016818	hydrolase activity, acting on acid anhyd...	310	15	9.07	0.0379	0.748925352112676	MF
